UNLOCODE,Alternative UNLOCODEs,Terminal Code,Terminal Facility Name,Terminal Company Name,Latitude (DMS),Longitude (DMS),Latitude,Longitude,Last change,Valid from,Valid until,Terminal Website,Terminal Address,Remarks
AEJEA,,DPWJA,DP WORLD JEBEL ALI - CT1,DP WORLD JEBEL ALI,"N 24°59'32""","E 055°03'58""",24.992222,55.066111,,2012-10-05,,https://dpworld.ae/our-portfolio/jebel-ali-port/,"PO Box 17000, Dubai, United Arab Emirates",
AEJEA,,DPWJ2,DP WORLD JEBEL ALI - CT2,DP WORLD JEBEL ALI,"N 25°01'20""","E 055°03'42""",25.022222,55.061667,,2015-02-05,,https://dpworld.ae/our-portfolio/jebel-ali-port/,"PO Box 17000, Dubai, United Arab Emirates",
AEJEA,,DPWJ3,DP WORLD JEBEL ALI - CT3,DP WORLD JEBEL ALI,"N 24°59'21""","E 055°03'03""",24.989167,55.050833,2020-01-03,2015-02-05,,https://dpworld.ae/our-portfolio/jebel-ali-port/,"PO Box 17000, Dubai, United Arab Emirates",
AEJEA,,DPWJ4,DP WORLD JEBEL ALI - CT4,DP WORLD JEBEL ALI,"N 25°01'57""","E 055°03'06""",25.0325,55.051667,,2019-06-04,,https://dpworld.ae/our-portfolio/jebel-ali-port/,"PO Box 17000, Dubai, United Arab Emirates",
AEKHL,,CSP,CSP ABU DHABI TERMINAL,COSCO SHIPPING PORTS ABU DHABI TERMINAL LLC,"N 24°49'01""","E 054°39'44""",24.816944,54.662222,2021-03-01,2020-12-01,,https://www.cspadt.ae,"CSP Abu Dhabi Terminal LLC, P.O Box 25530, Khalifa Port, Abu Dhabi, U.A.E.","Berths B07,B08,B09."
AEKHL,,ADT,KHALIFA PORT CONTAINER TERMINAL,ABU DHABI TERMINALS,"N 24°48'27""","E 054°38'58""",24.8075,54.649444,2021-03-01,2015-05-03,,https://www.adterminals.ae,"Khalifa Port Container Terminal Building 70 Taweelah, Abu Dhabi, U.A.E.",
AEKLF,,KCTKLF,KHORFAKKAN CONTAINER TERMINAL,KHORFAKKAN CONTAINER TERMINAL,"N 25°22'42""","E 056°22'31""",25.378333,56.375278,,2015-11-05,,https://www.gulftainer.com/terminals/uae/khorfakkan-container-terminal/,"P.O. Box 10326, Khorfakkan, U.A.E.",
AESHJ,,SHJSCT,SHARJAH CONTAINER TERMINAL,GULFTAINER CO LTD - SHARJAH,"N 25°21'29""","E 055°22'15""",25.358172,55.370769,,2019-03-19,,https://www.gulftainer.com/terminals/uae/sharjah-container-terminal/,"Port Khalid, P.O. Box 225, Sharjah, U.A.E.",
AOLAD,,SOPO,TERMINAL 5M - SOPORTOS,TERMINAL 5M - SOPORTOS,"S 08°47'13""","E 013°16'18""",-8.786944,13.271667,2020-01-03,2015-09-22,,,,
ARBHI,,TBB,TERMINAL BAHIA BLANCA,TERMINAL BAHIA BLANCA,"S 38°47'22""","W 062°16'37""",-38.789444,-62.276944,,2004-05-31,,https://puertobahiablanca.com/terminal-bb-eng.html,,
ARBUE,,TERM4,APM TERMINALS BUENOS AIRES T4,TERMINAL 4 S.A. / APM TERMINALS,"S 34°34'49""","W 058°22'05""",-34.580278,-58.368056,2020-08-01,2004-05-31,,https://www.apmterminals.com/en/buenos-aires,"Terminal 4, Calle 8 y Av. Edison S/N, Puerto Nuevo, C1104BCA Buenos Aires, Argentina",Terminal 4
ARBUE,,EXOL,EXOLGAN CONTAINER TERMINAL BUENOS AIRES,EXOLGAN S.A.,"S 34°38'24""","W 058°20'48""",-34.64,-58.346667,2020-08-01,2004-05-31,,https://www.exolgan.com/,"Manuel Alberti 1780, Dock Sud, Avellaneda, B1871ESF Buenos Aires, Argentina",
ARBUE,,BSAS,HUTCHISON BACTSSA TERMINAL T5,BUENOS AIRES CONTAINER TERMINAL SERVICES S.A. / HUTCHISON PORTS,"S 34°34'37""","W 058°22'24""",-34.576944,-58.373333,2020-08-01,2004-05-31,,http://www.bactssa.com.ar/en/,"Terminal 5, Av. Edison y Prefectura, Naval Argentina, Puerto Nuevo, C1104BCA Buenos Aires, Argentina",Terminal 5
ARBUE,,TRP,TERMINALES RIO DE LA PLATA,TERMINALES RIO DE LA PLATA S.A. / DP WORLD,"S 34°35'05""","W 058°21'47""",-34.584722,-58.363056,,2005-09-19,,https://www.trp.com.ar/,"Av. Ramón Castillo and Av. Comodoro Py, Puerto Nuevo, 1104 Buenos Aires, Argentina","Terminals 1,2,3"
ARLPS,,LPMOL,LAS PALMAS MOLCA,TERMINAL LAS PALMAS MOLCA,"S 34°01'16""","W 059°07'39""",-34.021111,-59.1275,,2004-05-31,,http://terminallaspalmas.com/,,
ARMDQ,,COOTR,COOTRAPORT LTDA,COOTRAPORT LTDA,"S 38°02'49""","W 057°32'11""",-38.046944,-57.536389,,2004-05-31,,,,
ARPMY,,PUPUB,PTO PUBLICO,PUERTO PUBLICO & LOGINTER,"S 42°44'10""","W 065°02'19""",-42.736111,-65.038611,,2004-05-31,,,,
ARPUD,,PUDES,PUERTO DESEADO,COSTANERA SA,"S 47°45'13""","W 065°54'40""",-47.753611,-65.911111,,2004-05-31,,,,
ARROS,,TROSA,TERMINAL ROSARIO,TERMINAL ROSARIO,"S 32°58'36""","W 060°37'05""",-32.976667,-60.618056,,2004-05-31,,,,
ARSAE,,TSP,TERMINAL SAN ANTONIO ESTE,PATAGONIA NORTE SA TERMINAL DE SERVICIOS PORTUARIOS (TSP),"S 40°47'57""","W 064°52'57""",-40.799167,-64.8825,2020-12-01,2004-05-31,,http://www.patagonia-norte.com.ar/,,
ARUSH,,PLS,PATAGONIA LOGISTIC SOLUTIONS SA,PATAGONIA LOGISTIC SOLUTIONS SA,"S 54°48'32""","W 068°18'12""",-54.808889,-68.303333,,2004-05-31,,,,
ARZAE,,TZARA,TERMINAL ZARATE,TZ TERMINALES PORTUARIAS,"S 34°04'04""","W 059°02'06""",-34.067778,-59.035,,2004-05-31,,,,
ASPPG,,PAGO,PORT OF PAGO-PAGO,PORT OF PAGO PAGO,"S 14°16'36""","W 170°41'05""",-14.276667,-170.684722,,2004-05-31,,,,
AUADL,,FLACT,FLINDERS ADELAIDE CONTAINER TERMINAL,FLINDERS ADELAIDE CONTAINER TERMINAL,"S 34°46'10""","E 138°29'26""",-34.769444,138.490556,,2004-05-31,,https://www.flindersadelaidecontainerterminal.com.au/,"6 Coghlan Road, Outer Harbor SA 5018, Australia","Outer Harbor Berths 6,7"
AUBEL,,CONBE,QUBE PORTS BELL BAY,QUBE PORTS (NO.1) PTY LTD,"S 41°08'22""","E 146°51'17""",-41.139444,146.854722,,2014-04-17,,https://qube.com.au/about/locations/,"1 Mobil Road, Bell Bay TAS 7253, Australia",Berths 5-6
AUBNE,,AATFI,AAT BRISBANE FISHERMAN ISLANDS CARGO TERMINAL,AUSTRALIAN AMALGAMATED TERMINALS,"S 27°22'44""","E 153°09'59""",-27.378889,153.166389,2019-11-18,2014-04-17,,https://www.aaterminals.com.au/location-fisherman/,"Berth 3, Port Drive, Port of Brisbane QLD 4178, Australia",Wharves 1-3
AUBNE,,DPBNE,DP WORLD BRISBANE FISHERMAN ISLANDS,DP WORLD (AUSTRALIA),"S 27°22'23""","E 153°10'14""",-27.373056,153.170556,2019-11-18,2014-03-14,,https://www.dpworldaustralia.com.au/our-locations/brisbane/,"Wharf 4, Port Drive, Fisherman Islands, Port of Brisbane QLD 4178, Australia",Wharves 4-7
AUBNE,,HPAFI,HUTCHISON BRISBANE CONTAINER TERMINALS (BCT),"BRISBANE CONTAINER TERMINALS PTY LTD (BCT), HUTCHISON","S 27°21'36""","E 153°10'48""",-27.36,153.18,2019-11-18,2015-03-10,,https://www.hutchisonports.com.au/hutchisonports-brisbane/,"Berth 11, Peregrine Drive, Port of Brisbane, PO Box 1203, Wynnum QLD 4178, Australia",Wharves 11-12
AUBNE,,PTFIT,PATRICK BRISBANE AUTOSTRAD TERMINAL,PATRICK,"S 27°21'58""","E 153°10'33""",-27.366111,153.175833,2019-11-18,2001-06-26,,https://patrick.com.au/,"Berth 10, Curlew St, Port of Brisbane QLD 4178, Australia","Berths 8,9,10"
AUDRW,,CONDW,QUBE PORTS DARWIN,QUBE PORTS PTY LTD,"S 12°29'24""","E 130°52'50""",-12.49,130.880556,,2014-04-17,,https://www.darwinport.com.au/,,
AUFRE,,CONFR,DP WORLD FREMANTLE,DP WORLD (AUSTRALIA),"S 32°02'49""","E 115°44'30""",-32.046944,115.741667,2019-11-18,2014-04-17,,https://www.dpworldaustralia.com.au/our-locations/fremantle/,"Berths 4/5/6 North Quay, Rudderham Drive, North Fremantle WA 6159, Australia","Berths CT1,CT2"
AUFRE,,ASLFR,PATRICK FREMANTLE CONTAINER TERMINAL,PATRICK,"S 32°02'35""","E 115°44'43""",-32.043056,115.745278,2019-11-18,2004-05-31,,https://patrick.com.au/,"Berth 7, Port Beach Rd, North Fremantle WA 6159, Australia","Berths CT3,CT4"
AUFRE,,POPFRB,QUBE PORTS FREMANTLE,QUBE PORTS PTY LTD,"S 32°02'23""","E 115°45'03""",-32.039722,115.750833,,2020-08-01,,https://qube.com.au/about/locations/,"Gate 4, Berths 11/12, Napier Road, North Fremantle WA 6159, Australia","Berths 11,12"
AUMEL,,AATAD,AAT MELBOURNE APPLETON DOCK,AUSTRALIAN AMALGAMATED TERMINALS,"S 37°49'01""","E 144°55'17""",-37.816944,144.921389,,2020-08-01,,https://www.aaterminals.com.au/location-appleton/,"Shed D, Appleton Dock Road, West Melbourne VIC 3003, Australia",
AUMEL,,CONWS,DP WORLD WEST SWANSON DOCK TERMINAL,DP WORLD (AUSTRALIA),"S 37°48'50""","E 144°54'43""",-37.813889,144.911944,2019-11-18,2014-04-17,,https://www.dpworldaustralia.com.au/our-locations/melbourne/,"Mackenzie Rd, West Melbourne VIC 3003, Australia","Berths 1,2,3 West"
AUMEL,,ASES1,PATRICK EAST SWANSON DOCK TERMINAL,PATRICK,"S 37°48'50""","E 144°54'55""",-37.813889,144.915278,2020-01-03,2004-05-31,,https://patrick.com.au/,"2 Phillipps Road, West Melbourne VIC 3003, Australia","Berths 1,2,3 East"
AUMEL,,CONMEL,QUBE PORTS APPLETON DOCK,QUBE PORTS PTY LTD,"S 37°49'02""","E 144°55'15""",-37.817222,144.920833,,2014-04-17,,https://qube.com.au/about/locations/,"Appleton Dock Road, West Melbourne VIC 3003, Australia",
AUMEL,,VICTM,VICT WEBB DOCK EAST,VICTORIA INTERNATIONAL CONTAINER TERMINAL,"S 37°50'49""","E 144°54'39""",-37.846944,144.910833,2019-11-18,2017-04-26,,https://www.vict.com.au/,"78 Webb Dock Dr, Port Melbourne VIC 3207, Australia",
AUPKL,,AATPK,AAT PORT KEMBLA,AUSTRALIAN AMALGAMATED TERMINALS,"S 34°27'17""","E 150°53'19""",-34.454722,150.888611,,2004-05-31,,https://www.aaterminals.com.au/location-portkembla/,"Yampi Way (Off Tom Thumb Road), Port Kembla NSW 2505, Australia","Berths 103,105,106,107"
AUSYD,,CTLPB,DP WORLD SYDNEY,DP WORLD (AUSTRALIA),"S 33°58'15""","E 151°12'59""",-33.970833,151.216389,2019-12-13,2004-05-31,,https://www.dpworldaustralia.com.au/our-locations/sydney/,"42 Friendship Rd, Port Botany NSW 2036, Australia",
AUSYD,,HPAPB,HUTCHISON SYDNEY INTERNATIONAL CONTAINER TERMINAL (SICTL),SYDNEY INTERNATIONAL CONTAINER TERMINALS PTY LTD (SICTL),"S 33°57'49""","E 151°12'02""",-33.963611,151.200556,2019-12-13,2015-03-10,,https://www.hutchisonports.com.au/hutchisonports-sydney/,"Gates B150-160 Foreshore Road, Botany NSW 2019, Australia",
AUSYD,,ASLPB,PATRICK SYDNEY AUTOSTRAD TERMINAL,PATRICK,"S 33°58'08""","E 151°12'38""",-33.968889,151.210556,2019-12-13,2004-05-31,,https://patrick.com.au/,"Gate B110 Penrhyn Road, Port Botany NSW 2036, Australia","Berths 6,7,8,9"
AWORJ,,AWBAR,BARCADERA CONTAINER TERMINAL,ARUBA STEVEDORING COMPANY (ASTEC) N.V.,"N 12°28'47""","W 069°59'50""",12.479722,-69.997222,2020-02-29,2016-09-19,,https://www.arubaports.com/main/barcadera/,,
AWORJ,,ASTEC,PORT OF ORANJESTAD,ARUBA PORTS AUTHORITY N.V.,"N 12°31'21""","W 070°02'47""",12.5225,-70.046389,2020-02-29,2004-05-31,,https://www.arubaports.com/main/oranjestad/,,Container operations moved to Barcadera.
BDCGP,,BDPORT,CHITTAGONG PORT,CHITTAGONG PORT AUTHORITY,"N 22°18'19""","E 091°47'55""",22.305278,91.798611,2020-04-01,2015-05-03,,http://www.cpa.gov.bd/,,"Three terminals (GCB, CCT, NCT), but only one operator (Chittagong Port Authority)"
BDMUN,,SAPLRT,SAPL INLAND WATER CONTAINER TERMINAL,SUMMIT ALLIANCE PORT LIMITED,"N 23°34'27""","E 090°30'43""",23.5743,90.512075,,2019-12-06,,https://www.saplbd.com,"West Muktarpur, Panchashar, Munshiganj - 1500, Bangladesh",
BEANR,,ACOT,ANTWERP CONTAINER TERMINAL (K730),ANTWERP CONTAINER TERMINAL - SEA INVEST,"N 51°19'27""","E 004°20'47""",51.324167,4.346389,,2019-07-05,,https://www.sea-invest.com,"Sea-invest, 730, Antwerpsebaan 57, 2040 Antwerp, Belgium",
BEANR,,AET,ANTWERP EUROTERMINAL NV (K1329-K1347),ANTWERP EUROTERMINAL NV,"N 51°16'23""","E 004°12'12""",51.273056,4.203333,,2016-07-26,,https://www.portofantwerp.com/en/node/4081,"AET, 1329-1347, Blikken 1333, 9130 Verrebroek, Belgium",
BEANR,,1700,ANTWERP GATEWAY TERMINAL (K1700-K1710),DP WORLD (ANTWERP),"N 51°17'31""","E 004°15'56""",51.291944,4.265556,2020-01-03,2014-04-17,,http://www.dpworldantwerp.com/our-businesses/antwerp-gateway,"DP World Antwerp, 1700-1710, Molenweg Haven 1950, 9130 Doel, Belgium",
BEANR,,BNFW,BELGIAN NEW FRUIT WHARF (K206-K212),SEA-INVEST FRUIT AND FOOD DIVISION - BNFW,"N 51°15'42""","E 004°22'42""",51.261667,4.378333,2020-01-03,2015-10-30,,,,
BEANR,,K420,CHURCHILL TERMINAL (K402-K428),PSA-ANTWERP,"N 51°16'44""","E 004°21'55""",51.278889,4.365278,2020-01-03,2014-07-14,,https://www.portofantwerp.com/en/node/4094,"PSA Antwerp, 408-416, Wilmarsstraat 7, 2030 Antwerp, Belgium",
BEANR,,K869,EUROPA TERMINAL (K851-K869),PSA-ANTWERP,"N 51°20'18""","E 004°16'34""",51.338333,4.276111,2020-01-03,2014-07-14,,https://www.portofantwerp.com/en/node/4092,"PSA Antwerp, 851-869, Scheldelaan 495, 2040 Antwerp, Belgium",
BEANR,,K1742,MPET DEURGANCK DOCK (K1742),MSC PSA EUROPEAN TERMINAL,"N 51°17'34""","E 004°15'27""",51.292778,4.2575,2020-01-03,2014-07-14,,https://www.mpet.be/,"Sint-Antoniusweg, 9130 Doel, Belgium",
BEANR,,K913,NOORDZEE TERMINAL (K903-K913),PSA-ANTWERP,"N 51°21'03""","E 004°15'55""",51.350833,4.265278,2020-01-03,2014-07-14,,https://www.portofantwerp.com/en/node/4091,"PSA Antwerp, 901-913, Scheldelaan 601, 2040 Antwerp, Belgium",
BEZEE,,CSPZ,CSP ZEEBRUGGE TERMINAL,CSP ZEEBRUGGE TERMINAL NV,"N 51°20'51""","E 003°11'20""",51.3475,3.188889,,2021-03-01,,https://cspterminals.be/,"Leopold II-Dam, Kaai 120-122, 8380 Zeebrugge, Belgium",
BGBOJ,,ACT,ADVANCE CONTAINER TERMINAL BURGAS,BMF PORT BURGAS JSC,"N 42°29'08""","E 027°27'31""",42.485556,27.458611,,2020-12-01,,http://www.actburgas.bg/,"Knyaz Alexander Batenberg Str. 1, 8000 Harbour complex, Burgas, Bulgaria",Terminal West
BHBAH,BHKBS,POSU,APM TERMINALS BAHRAIN,APM TERMINALS BAHRAIN B.S.C. (C),"N 26°11'06""","E 050°42'48""",26.185,50.713333,2020-01-24,2015-09-21,,https://www.apmterminals.com/en/bahrain,"Khalifa Bin Salman Port, PO Box 50490, Hidd, Kingdom of Bahrain",
BJCOO,,BTER,BENIN TERMINAL,PORT AUTONOME DE COTONOU / BOLLORE PORTS / APM TERMINALS,"N 06°20'48""","E 002°25'08""",6.346667,2.418889,2020-05-01,2015-09-22,,http://www.portcotonou.com/,"Port Autonome de Cotonou, Boulevard de la Marina Littoral, BP 927 Cotonou, Benin",
BRFOR,,TOT,TERMACO OCEAN TERMINAL,TERMACO TERMINAIS MAR DE CONTAINERS E SERV ACES LTDA,"S 03°42'35""","W 038°28'27""",-3.709722,-38.474167,2020-02-29,2004-05-31,,,,
BRIBB,,TECIB,TECON IMBITUBA SA,TECON IMBITUBA SA,"S 28°13'47""","W 048°39'00""",-28.229722,-48.65,,2004-05-31,,,,
BRIOA,,ITP,ITAPOA TERMINAIS PORTUARIOS S/A,ITAPOA TERMINAIS PORTUARIOS S/A,"S 26°10'56""","W 048°36'19""",-26.182222,-48.605278,,2004-05-31,,,,
BRITJ,,BRAITJ,APM TERMINALS ITAJAI,APM TERMINALS ITAJAI,"S 26°54'05""","W 048°39'52""",-26.901389,-48.664444,2020-01-24,2015-10-12,,https://www.apmterminals.com/en/itajai,"Av. Coronel Eugenio Muller, 300, 88.301-120, Itajaí, SC, Brazil",
BRITJ,,TECVI,TECONVI SA TERM CNTRS VALE ITAJAI,TECONVI SA TERM CNTRS VALE ITAJAI,"S 26°54'06""","W 048°39'51""",-26.901667,-48.664167,,2004-05-31,,,,
BRMAO,,CHINC,CHIBATAO NAVEGACAO E COMERCIO LTDA,CHIBATAO NAVEGACAO E COMERCIO LTDA,"S 03°09'24""","W 059°59'24""",-3.156667,-59.99,,2004-05-31,,,,
BRMAO,,SUPER,SUPER TERMINAIS,SUPER TERMINAIS COM E IND LTDA,"S 03°08'59""","W 059°59'54""",-3.149722,-59.998333,,2004-05-31,,,,
BRNVT,,PTP,PORTONAVE SA TERMINAIS PORTUARIOS,PORTONAVE SA TERMINAIS PORTUARIOS,"S 26°53'47""","W 048°39'46""",-26.896389,-48.662778,,2004-05-31,,,,
BRPEC,,BRAPEC,APM TERMINALS PECEM,APM TERMINALS PECEM OPERACOES PORTUARIAS LTDA,"S 03°32'55""","W 038°48'39""",-3.548611,-38.810833,,2015-10-13,,https://www.apmterminals.com/en/pecem,"Rua SDO27, Number 10, S / N - Block B - Room 4, São Gonçalo do Amarante - Ceará, CEP 60310-240, Brazil",
BRPNG,,TCP,TCP DE CONTEINERES DE PARANAGUA SA,TCP DE CONTEINERES DE PARANAGUA SA,"S 25°30'10""","W 048°30'07""",-25.502778,-48.501944,,2004-05-31,,,,
BRRIG,,SUPMA,SUPERMAR SA,SUPERMAR SA,"S 32°02'27""","W 052°04'34""",-32.040833,-52.076111,,2004-05-31,,,,
BRRIG,,TECRG,TECON RIO GRANDE SA,TECON RIO GRANDE SA,"S 32°07'33""","W 052°06'14""",-32.125833,-52.103889,,2004-05-31,,,,
BRRIO,,LIBRJ,LIBRA TERMINAIS SA,LIBRA TERMINAIS SA,"S 22°52'28""","W 043°12'21""",-22.874444,-43.205833,,2004-05-31,,,,
BRRIO,,MROP,MULTI RIO OPERACOES PORTUARIA SA,MULTI RIO OPERACOES PORTUARIA SA,"S 22°52'37""","W 043°12'27""",-22.876944,-43.2075,,2004-05-31,,,,
BRSFS,,TESC,TESC TERMINAL SANTA CATARINA SA,TESC TERMINAL SANTA CATARINA SA,"S 26°14'05""","W 048°38'07""",-26.234722,-48.635278,,2004-05-31,,,,
BRSLZ,BRIQI,PCTN,PORT OF ITAQUI,EMAP - ITAQUI PORT AUTHORITY,"S 02°34'36""","W 044°22'12""",-2.576667,-44.37,2020-10-01,2019-10-18,,http://www.portodoitaqui.ma.gov.br,"Av. Dos Portugueses s/n, CEP 65085-370, Porto do Itaqui, São Luís, Maranhão, Brazil",
BRSPB,,TECSE,SEPETIBA TECON SA,SEPETIBA TECON SA,"S 22°55'50""","W 043°50'18""",-22.930556,-43.838333,,2004-05-31,,,,
BRSSA,,TECSV,TECON SALVADOR SA,TECON SALVADOR SA,"S 12°57'28""","W 038°30'25""",-12.957778,-38.506944,,2004-05-31,,,,
BRSSZ,,BTP,BRASIL TERMINAL PORTUARIO S.A. SANTOS,BRASIL TERMINAL PORTUARIO S.A. SANTOS,"S 23°55'19""","W 046°21'10""",-23.921944,-46.352778,,2014-07-22,,,,
BRSSZ,,ECOS,ECOPORTO SANTOS,ECOPORTO SANTOS,"S 23°55'40""","W 046°20'07""",-23.927778,-46.335278,,2014-07-22,,,,
BRSSZ,,EMBRA,EMBRAPORT,EMBRAPORT EMPRESA BRASILEIRA,"S 23°55'18""","W 046°18'56""",-23.921667,-46.315556,,2004-05-31,,,,
BRSSZ,,LIBSS,LIBRA TERMINAIS SA,LIBRA TERMINAIS SA,"S 23°58'18""","W 046°17'46""",-23.971667,-46.296111,,2004-05-31,,,,
BRSSZ,,RODRI,RODRIMAR SA TRANSP EQUIP INDUSTRIAL,RODRIMAR SA TRANSP EQUIP INDUSTRIAL,"S 23°55'35""","W 046°20'28""",-23.926389,-46.341111,,2004-05-31,,,,
BRSSZ,,SSA,SANTOS BRASIL SA,SANTOS BRASIL SA,"S 23°57'45""","W 046°17'36""",-23.9625,-46.293333,,2004-05-31,,,,
BRSUA,,TECSU,TECON SUAPE SA,TECON SUAPE SA,"S 08°23'35""","W 034°58'03""",-8.393056,-34.9675,,2004-05-31,,,,
BRVDC,,CONVI,CONVICON,CONVICON CONTEINERES DE VILA DO CONDE S/A,"S 01°32'22""","W 048°45'15""",-1.539444,-48.754167,2019-04-01,2004-05-31,,,,
BRVIX,,TDVV,TERMINAL DE VILA VELHA SA,TERMINAL DE VILA VELHA SA,"S 20°19'28""","W 040°19'44""",-20.324444,-40.328889,,2004-05-31,,,,
CAHAL,,FCOVE,FAIRVIEW COVE CONTAINER TERMINAL,CERES HALIFAX INC.,"N 44°40'04""","W 063°37'38""",44.667778,-63.627222,2020-01-24,2015-01-29,,https://www.ceresglobal.com/locations/halifax.html,"6708 Bayne Street, Halifax, Nova Scotia B3K 5M6, Canada",
CAHAL,,HAFXT,SOUTH END CONTAINER TERMINAL,PSA HALIFAX,"N 44°37'42""","W 063°33'45""",44.628333,-63.5625,2020-01-24,2013-06-05,,https://www.portofhalifax.ca/facilities/hpa-facilities/psa-halifax-south-end-container-terminal/,"577 Marginal Rd, Halifax, Nova Scotia B3H 4P6, Canada",
CAMTR,,MGTCAS,CAST TERMINAL (SECTION 77),MONTREAL GATEWAY TERMINALS,"N 45°35'13""","W 073°30'16""",45.586944,-73.504444,2020-01-24,2015-02-19,,https://www.mtrtml.com/maps/index.php,,
CAMTR,,TMTMAI,MAISONNEUVE TERMINAL (SECTION 68),TERMONT TERMINAL INC,"N 45°34'26""","W 073°30'41""",45.573889,-73.511389,2020-01-24,2015-02-19,,http://www.termont.com/,,
CAMTR,,MGTRAC,RACINE TERMINAL (SECTION 62),MONTREAL GATEWAY TERMINALS,"N 45°33'57""","W 073°31'07""",45.565833,-73.518611,2020-01-24,2015-02-19,,https://www.mtrtml.com/maps/index.php,,
CAPRR,,FCTPRR,FAIRVIEW CONTAINER TERMINAL,DP WORLD,"N 54°17'11""","W 130°21'37""",54.286389,-130.360278,2020-01-24,2018-03-07,,https://www.rupertport.com/terminal_details/fairview-container-terminal/,,
CAVAN,,CTM,CENTENNIAL TERMINAL (CENTERM),DP WORLD VANCOUVER,"N 49°17'20""","W 123°05'45""",49.288889,-123.095833,2020-01-24,2016-08-12,,https://www.dpworld.ca/,"777 Centennial Road, Vancouver, BC V6A 1A3, Canada",
CAVAN,,FSD,FRASER SURREY DOCKS,FRASER SURREY DOCKS LIMITED PARTNERSHIP,"N 49°11'09""","W 122°54'48""",49.185833,-122.913333,2020-01-24,2004-05-31,,http://www.fsd.bc.ca/,"11060 Elevator Rd, Surrey, BC V3V 2R7, Canada",
CAVAN,CADEL,DLT,GCT DELTAPORT,GCT CANADA LIMITED PARTNERSHIP,"N 49°01'14""","W 123°09'05""",49.020556,-123.151389,2020-01-24,2006-08-28,,https://globalterminalscanada.com/contact/#Terminals,"2 Roberts Bank Way, BC V4M 4G5, Canada",
CAVAN,,VTM,GCT VANTERM,GCT CANADA LIMITED PARTNERSHIP,"N 49°17'19""","W 123°04'26""",49.288611,-123.073889,2020-01-24,2006-08-28,,https://globalterminalscanada.com/contact/#Terminals,"1300 Stewart Street, BC V5L 4X5, Canada",
CGPNR,,CTPN,CONGO TERMINAL POINTE NOIRE,CONGO TERMINAL POINTE NOIRE / BOLLORE PORTS,"S 04°47'30""","E 011°49'48""",-4.791667,11.83,,2016-05-13,,http://www.congo-terminal.net,,
CIABJ,,SETV1,VRIDI TERMINAL ABIDJAN,SOCIETE EXPLOITATION TERMINAL DE VRIDI (SETV) / BOLLORE PORTS / APM TERMINALS,"N 05°16'25""","W 004°00'48""",5.273611,-4.013333,2020-01-24,2015-10-09,,http://www.abidjan-terminal.com/,,
CLANF,,ATI,ATI ANTOFAGASTA,ANTOFAGASTA TERMINAL INTERNACIONAL S.A.,"S 23°39'00""","W 070°24'29""",-23.65,-70.408056,,2004-05-31,,https://www.atiport.cl/,"Av. Grecia S/N, costado recinto portuario, Antofagasta, Chile",
CLANF,,EPA,EPA ANTOFAGASTA,EMPRESA PORTUARIA ANTOFAGASTA,"S 23°39'00""","W 070°24'17""",-23.65,-70.404722,,2004-05-31,,https://www.anfport.cl/,"Av. Grecia S/N, Antofagasta, Chile",
CLARI,,TPA,TERMINAL PACIFICO ARICA,TERMINAL PUERTO ARICA S.A.,"S 18°28'23""","W 070°19'42""",-18.473056,-70.328333,,2004-05-31,,http://portal.tpa.cl/tpaweb/,"Av. Máximo Lira 389, Arica, Chile",
CLCNL,,CPC,PUERTO CORONEL,PUERTO DE CORONEL S.A.,"S 37°02'02""","W 073°09'10""",-37.033889,-73.152778,,2016-09-01,,https://www.puertocoronel.cl,"Av. Carlos Prats 40, Coronel, Chile",
CLIQQ,,ITI,ITI IQUIQUE,IQUIQUE TERMINAL INTERNACIONAL S.A.,"S 20°12'16""","W 070°09'23""",-20.204444,-70.156389,2021-03-01,2004-05-31,,https://www.saam.com/en/port-terminals/iquique-internationl-terminal-iti/,"Jorge Barrera, Iquique, Tarapacá, Chile",
CLLQN,,PLIRQ,PUERTO LIRQUEN,PUERTO DE LIRQUEN S.A.,"S 36°42'28""","W 072°59'23""",-36.707778,-72.989722,,2004-05-31,,https://www.dpworldlirquen.cl/en/home/,"Recinto Portuario S/N, Lirquén, Chile",
CLPAG,,PANGA,PUERTO ANGAMOS,COMPANIA PORTUARIA MEJILLONES S.A.,"S 23°04'00""","W 070°23'12""",-23.066667,-70.386667,,2004-05-31,,https://www.puertoangamos.cl/en/,"Av. Longitudinal 5500, Barrio Industrial, Mejillones, Antofagasta, Chile",
CLPUQ,,SMA,TERMINAL SANTOS MARDONES,EPAUSTRAL,"S 53°07'32""","W 070°51'31""",-53.125556,-70.858611,2020-01-24,2016-01-25,,https://www.epaustral.cl,"Libertador Bernardo O'Higgins No. 1385, Punta Arenas, Chile",
CLSAI,,PCE,PUERTO CENTRAL SAN ANTONIO,PUERTO CENTRAL S.A.,"S 33°35'30""","W 071°37'00""",-33.591667,-71.616667,,2016-09-16,,https://www.dpworldsanantonio.cl/en/home/,"Alan Macowan 240, San Antonio, Chile",
CLSAI,,STI,STI SAN ANTONIO,SAN ANTONIO TERMINAL INTERNACIONAL S.A.,"S 33°35'21""","W 071°37'19""",-33.589167,-71.621944,,2004-05-31,,https://www.stiport.com/,"Av. Ramón Barros Luco 1613, Piso 13 San Antonio, Chile",
CLSVE,,SVTI,SVTI SAN VICENTE OCEAN TERMINAL,SAN VICENTE TERMINAL INTERNACIONAL,"S 36°43'51""","W 073°08'16""",-36.730833,-73.137778,,2004-05-31,,https://www.svti.cl/,"Av. Latorre 1590, Talcahuano, Chile",
CLVAP,,EPV,EPV VALPARAISO,EMPRESA PORTUARIA DE VALPARAISO,"S 33°02'13""","W 071°37'33""",-33.036944,-71.625833,,2004-05-31,,http://www.tcval.cl/en/,"Av. Errázuriz 755, Valparaíso, Chile","Terminal 2, berths 6-8. Operator is ""Terminal Cerros de Valparaíso, S.A. (TCVAL)""."
CLVAP,,TPS,TPS VALPARAISO,TERMINAL PACIFICO SUR VALPARAISO S.A.,"S 33°01'54""","W 071°37'38""",-33.031667,-71.627222,,2004-05-31,,https://www.tps.cl/,"Antonio Varas 2, Valparaíso, Chile","Terminal 1, berths 1-5."
CNCQI,CNCHQ,CUNTAN,CUNTAN TERMINAL,"CHONGQING INTERNATIONAL CONTAINER TERMINAL CO., LTD.","N 29°37'05""","E 106°35'30""",29.618056,106.591667,,2020-07-01,,http://www.cqgj.com.cn/,"No. 306, Hai'er Road, Jiangbei District, Chongqing, China",
CNDAL,CNDAG,DPCT,DALIAN CONTAINER TERMINAL,"DALIAN CONTAINER TERMINAL CO., LTD.","N 39°00'32""","E 121°52'25""",39.008889,121.873611,,2020-08-01,,,"Dayao Bay Port, Kai Fa District, Dalian, China",
CNDCB,,DACHAN,DA CHAN BAY TERMINAL ONE,"SHENZHEN DA CHAN BAY MODERN PORT DEVELOPMENT CO., LTD.","N 22°32'00""","E 113°51'20""",22.533333,113.855556,,2015-09-21,,http://www.dcbterminals.com//en/,"DaChan Bay Terminals, Xi Xiang, Bao An District, Shenzhen, China",
CNFZH,,FICT,FUZHOU INTERNATIONAL CONTAINER TERMINAL,FUZHOU INTERNATIONAL CONTAINER TERMINAL,"N 25°25'00""","E 119°17'09""",25.416667,119.285833,,2020-07-01,,http://www.fct-fuzhou.com.cn/,"Xin Jiang Road, Jiangyin, Fuqing Fujian, 350309, China",
CNFZH,,FMP,FUZHOU QINGZHOU CONTAINER TERMINAL,"FUZHOU QINGZHOU CONTAINER TERMINAL CO., LTD","N 26°00'18""","E 119°28'41""",26.005,119.478056,,2020-07-01,,http://www.fct-fuzhou.com.cn/,"113 Luoxing Road Mawei, Fujian Fuzhou, 350015, China",
CNLYG,,LNOCT,LIANYUNGANG NEW ORIENTAL INTERNATIONAL CONTAINER TERMINAL,LIANYUNGANG NEW ORIENTAL INTERNATIONAL CONTAINER TERMINAL,"N 34°44'43""","E 119°25'40""",34.745278,119.427778,2020-04-01,2019-01-17,,http://www.lnoct.com,"Miaoling Port, Lianyun District, Lianyungang, China",
CNLYG,,LPCT,LYG-PSA CONTAINER TERMINAL,"LYG-PSA CONTAINER TERMINAL CO., LTD.","N 34°44'52""","E 119°26'12""",34.747778,119.436667,2020-04-01,2019-01-17,,http://www.lyg-psa.com,"Miaoling Port, Lianyun District, Lianyungang, China",
CNNBO,CNNBG,BLCT1,NINGBO BEILUN INTERNATIONAL CONTAINER TERMINAL (NBCT),"NINGBO BEILUN INTERNATIONAL CONTAINER TERMINAL CO., LTD.","N 29°56'10""","E 121°52'00""",29.936111,121.866667,2020-08-01,2004-05-31,,http://www.nbct.com.cn/,"No. 178, North Pole Star Road, Beilun District, Ningbo, China",
CNNBO,CNNBG,BLCT2,NINGBO BEILUN SECOND CONTAINER TERMINAL (NBSCT),"NINGBO BEILUN SECOND CONTAINER TERMINAL CO., LTD","N 29°56'42""","E 121°50'12""",29.945,121.836667,2020-08-01,2004-05-31,,http://nbsct.nbport.com.cn/,"No. 227, Yingbin Road, Beilun District, Ningbo, China",
CNNBO,CNNBG,BLTCT,NINGBO BEILUN THIRD CONTAINER TERMINAL (BLTCT),"NINGBO BEILUN PORT GROUP THIRD CONTAINER TERMINAL CO., LTD.","N 29°53'20""","E 122°02'51""",29.888889,122.0475,,2020-08-01,,http://www.nbport.com.cn/bltct/,"Chuanshan Port, Beilun District, Ningbo, China",
CNNBO,CNNBG,BLCT5,NINGBO DAXIE CHINA MERCHANTS INTERNATIONAL CONTAINER TERMINAL (CMICT),NINGBO DAXIE CHINA MERCHANTS INTERNATIONAL CONTAINER TERMINALS,"N 29°56'07""","E 121°55'39""",29.935278,121.9275,2020-08-01,2004-05-31,,http://www.cmict.com.cn/?lang=en-us,"Port District D,Daxie Development Zone,Ningbo",
