UNLOCODE,Alternative UNLOCODEs,Terminal Code,Terminal Facility Name,Terminal Company Name,Latitude (DMS),Longitude (DMS),Latitude,Longitude,Last change,Valid from,Valid until,Terminal Website,Terminal Address,Remarks
JPTYO,,CBY1,CHUO BOUHATEI Y1 CONTAINER TERMINAL,"KAMIGUMI CO., LTD.","N 35°35'25""","E 139°47'50""",35.590278,139.797222,,2020-10-01,,https://kamigumi-tokyo-container.jp/,"Kamigumi Tokyo Container Terminal Y1, 1-1, Reiwajima 1-Chome, Ota-ku, Tokyo, Japan","Also known as ""Kamigumi Tokyo Container Terminal Y1"""
JPTYO,,CBY2,CHUO BOUHATEI Y2 CONTAINER TERMINAL,MITSUI SOKO / NIPPON EXPRESS / SUMITOTO WAREHOUSE / SANKYU,"N 35°35'19""","E 139°48'01""",35.588611,139.800278,,2020-10-01,,https://www.y2terminal.com/,"Y2 Container Terminal 1-1, Reiwajima 1-Chome, Ota-ku,Tokyo, Japan",
JPTYO,,OHK,OHI CONTAINER TERMINAL BERTH NO. 1/2,"KAWASAKI KISEN KAISHA, LTD.","N 35°36'42""","E 139°45'46""",35.611667,139.762778,2020-01-24,2015-05-11,,http://www.tptc.co.jp/en/guide/oi/about,,
JPTYO,,OHM,OHI CONTAINER TERMINAL BERTH NO. 3/4,"MITSUI O.S.K. LINES, LTD. (UTOC / TICT)","N 35°36'21""","E 139°45'55""",35.605833,139.765278,2020-01-24,2015-05-11,,http://www.tptc.co.jp/en/guide/oi/about,,
JPTYO,,OHA,OHI CONTAINER TERMINAL BERTH NO. 5,"WAN HAI LINES.LTD. (AZUMA SHIPPING CO., LTD.)","N 35°36'07""","E 139°46'05""",35.601944,139.768056,2020-01-24,2015-05-11,,http://www.tptc.co.jp/en/guide/oi/about,,
JPTYO,,OHN,OHI CONTAINER TERMINAL BERTH NO. 6/7,NIPPON YUSEN KAISHA LTD. / UNIX CORP.,"N 35°35'53""","E 139°46'16""",35.598056,139.771111,2020-01-24,2015-05-11,,http://www.tptc.co.jp/en/guide/oi/about,,
JPTYO,,SHG,SHINAGAWA CONTAINER TERMINAL,DAIICHI / SUMITOMO / NIPPON EXPRESS / SANKYU / AZUMA SHIPPING,"N 35°37'45""","E 139°45'33""",35.629167,139.759167,2020-01-24,2015-05-08,,http://www.tptc.co.jp/en/guide/shinagawa/about,,Berths SC/SD/SE/SF
JPUBJ,,SF01C,SHIBANAKA BERTH NO. 1,SHIBANAKA NO. 1 BERTH,"N 33°56'14""","E 131°14'15""",33.937222,131.2375,2019-11-20,2001-06-26,,,,
JPUBJ,,SWW,SHIBANAKA WEST WHARF (SHIBANAKANISI),SHIBANAKA WEST WHARF (SHIBANAKANISI),"N 33°55'58""","E 131°14'00""",33.932833,131.233306,,2020-01-01,,,,
JPUKB,,KCT,"KAMIGUMI KOBE CONTAINER TERMINAL (KGCT), PC-18","KAMIGUMI CO., LTD.","N 34°40'00""","E 135°14'05""",34.666667,135.234722,2020-10-01,2004-05-31,,https://www.kamigumi.co.jp/english/company/network/container.html,,
JPUKB,,PIM,PORT ISLAND M BERTH,PORT ISLAND M BERTH (IMOTO LINES),"N 34°39'07""","E 135°14'37""",34.652,135.243722,,2019-10-04,,,"9 Chome Minatojima, Chuo Ward, Kobe, Hyogo 650-0045, Japan",
JPUKB,,PC13,PORT ISLAND PC-13,KAMIGUMI / SUMITOMO WAREHOUSE,"N 34°39'30""","E 135°13'48""",34.658333,135.23,2020-01-03,2015-06-20,,https://hanshinport.co.jp/en/facilities/,,
JPUKB,,PC14,PORT ISLAND PC-14,NISSIN CORPORATION,"N 34°39'34""","E 135°14'01""",34.659444,135.233611,2020-01-03,2015-06-20,,https://hanshinport.co.jp/en/facilities/,,
JPUKB,,PC15,PORT ISLAND PC-15,"MITSUI O.S.K. LINES, LTD / SANKYU / SUMITOMO WAREHOUSE / NICKEL & LYONS, LTD.","N 34°39'38""","E 135°14'19""",34.660556,135.238611,2020-01-03,2015-06-20,,https://hanshinport.co.jp/en/facilities/,,
JPUKB,,PC16,PORT ISLAND PC-16/17,"MITSUI O.S.K. LINES, LTD / SANKYU / SUMITOMO WAREHOUSE / NICKEL & LYONS, LTD.","N 34°39'20""","E 135°14'31""",34.655556,135.241944,2020-01-03,2015-06-20,,https://hanshinport.co.jp/en/facilities/,,
JPUKB,,RC4,ROKKO ISLAND RC-4,KAWASAKI KISEN KAISHA LTD. / MITSUBISHI LOGISTICS CORPORATION,"N 34°40'43""","E 135°15'31""",34.678611,135.258611,2020-01-03,2015-06-30,,https://hanshinport.co.jp/en/facilities/,,
JPUKB,,RC5,ROKKO ISLAND RC-5,KAWASAKI KISEN KAISHA LTD. / MITSUBISHI LOGISTICS CORPORATION,"N 34°40'45""","E 135°15'50""",34.679167,135.263889,2020-01-03,2015-06-30,,https://hanshinport.co.jp/en/facilities/,,
JPUKB,,RC6,ROKKO ISLAND RC-6/7,NIPPON YUSEN KABUSHIKI KAISHA,"N 34°40'53""","E 135°17'05""",34.681389,135.284722,2020-01-03,2015-06-30,,https://hanshinport.co.jp/en/facilities/,,
JPUKB,,RWX,ROKKO ISLAND RWX,ROKKO ISLAND RWX (MITSUBISHI LOGISTICS),"N 34°41'21""","E 135°16'50""",34.689167,135.280556,,2019-10-04,,,,"Berths W, X, Y, Z, L1 & L2"
JPUKB,,RSBC,ROKKO ISLAND SOUTH B/C BERTH,IMOTO LINES,"N 34°40'50""","E 135°16'41""",34.680444,135.278056,,2019-10-18,,,,
JPWKJ,,SE01C,SUEHIRO PIER EAST,SUEHIRO PIER EAST,"N 45°24'15""","E 141°41'28""",45.404167,141.691111,2020-02-29,2001-06-26,,http://www.mlit.go.jp/common/001181872.pdf,,
JPYKK,,KSN,"KASUMIGAURA NORTH PIER, W80",JAPAN TRANSCITY CORPORATION,"N 34°59'50""","E 136°40'07""",34.997222,136.668611,2020-02-29,2015-06-16,,http://www.yokkaichi-port.or.jp/b_container_terminai.html,,
JPYKK,,KSS,"KASUMIGAURA SOUTH PIER, W26/W27",JAPAN TRANSCITY CORPORATION,"N 34°59'32""","E 136°39'51""",34.992222,136.664167,2020-02-29,2015-06-16,,http://www.yokkaichi-port.or.jp/b_container_terminai.html,,
JPYOK,,APMYOK,APM TERMINALS YOKOHAMA,APM TERMINALS,"N 35°24'08""","E 139°40'45""",35.402222,139.679167,2020-01-15,2016-09-01,,https://www.apmterminals.com/en/operations/asia-pacific/yokohama/about-us,,APMT operates at MINAMI-HONMOKU CONTAINER TERMINAL MC-1&2
JPYOK,,DC3,DAIKOKU CONTAINER TERMINAL C-3,"NIPPON EXPRESS / KAMIGUMI CO., LTD.","N 35°27'33""","E 139°41'36""",35.459167,139.693333,2020-01-15,2015-06-20,,http://www.yokohamaport.co.jp.e.df.hp.transer.com/facilities/daikoku/,,
JPYOK,,DC4,DAIKOKU CONTAINER TERMINAL C-4,NIPPON YUSEN KABUSHIKI KAISHA,"N 35°27'38""","E 139°41'47""",35.460556,139.696389,2020-01-15,2015-06-20,,http://www.yokohamaport.co.jp.e.df.hp.transer.com/facilities/daikoku/,,
JPYOK,,DT9,DAIKOKU CONTAINER TERMINAL T-9,"MITSUI SOKO CO., LTD. / SUMITOTO WAREHOUSE","N 35°27'28""","E 139°41'25""",35.457778,139.690278,2020-04-01,2015-06-20,,http://www.yokohamaport.co.jp.e.df.hp.transer.com/facilities/daikoku/,"Daikoku T9 Container Terminal, 25 Daikokufuto, Tsurumi-Ku, Yokohama, Kanagawa, Japan",
JPYOK,,HA5,HONMOKU CONTAINER TERMINAL A-5.6,"KAWASAKI KISEN KAISHA, LTD.","N 35°26'49""","E 139°40'21""",35.446944,139.6725,2020-01-24,2015-06-30,,http://www.yokohamaport.co.jp.e.df.hp.transer.com/facilities/honmoku/,,
JPYOK,,HA6,HONMOKU CONTAINER TERMINAL A-6.7,"KAWASAKI KISEN KAISHA, LTD. / NISSIN CORPORATION / KEIHIN KOUN CO.LTD.","N 35°26'40""","E 139°40'15""",35.444444,139.670833,2020-01-24,2015-06-30,,http://www.yokohamaport.co.jp.e.df.hp.transer.com/facilities/honmoku/,,
JPYOK,,HBC,HONMOKU CONTAINER TERMINAL BC,"YOKOHAMA PORT MEGA TERMINAL CO., LTD.","N 35°26'15""","E 139°40'43""",35.4375,139.678611,2020-01-24,2015-06-30,,http://www.yokohamaport.co.jp.e.df.hp.transer.com/facilities/honmoku/,,
JPYOK,,HD1,HONMOKU CONTAINER TERMINAL D-1,"YOKOHAMA PORT MEGA TERMINAL CO., LTD.","N 35°26'03""","E 139°40'51""",35.434167,139.680833,2020-01-24,2015-06-30,,http://www.yokohamaport.co.jp.e.df.hp.transer.com/facilities/honmoku/,,
JPYOK,,HD4,HONMOKU CONTAINER TERMINAL D-4,"AMERICAN PRESIDENT LINES, LTD.","N 35°26'16""","E 139°40'59""",35.437778,139.683056,2020-01-24,2015-06-30,,http://www.yokohamaport.co.jp.e.df.hp.transer.com/facilities/honmoku/,,
JPYOK,,HD5,HONMOKU CONTAINER TERMINAL D-5,"MITSUI O.S.K. LINES, LTD.","N 35°26'26""","E 139°41'05""",35.440556,139.684722,2020-01-24,2015-06-30,,http://www.yokohamaport.co.jp.e.df.hp.transer.com/facilities/honmoku/,,
JPYOK,,MHM,MINAMI-HONMOKU CONTAINER TERMINAL MC-3,"MITSUBISHI LOGISTICS CO., LTD.","N 35°24'01""","E 139°41'02""",35.400278,139.683889,2020-01-24,2015-06-20,,http://www.yokohamaport.co.jp.e.df.hp.transer.com/facilities/minamihonmoku/,,
KEMBA,,MCT,MOMBASA CONTAINER TERMINAL,KENYA PORTS AUTHORITY,"S 04°02'45""","E 039°37'37""",-4.045833,39.626944,2020-08-01,2018-05-04,,https://www.kpa.co.ke/OurBusiness/Pages/Container-Terminal-Operations.aspx,,"Berths 16,17,18,19"
KHKOS,,SPA,SIHANOUKVILLE PORT,SIHANOUKVILLE PORT AUTHORITY,"N 10°38'52""","E 103°30'38""",10.647778,103.510556,2020-01-24,2015-06-24,,http://www.pas.gov.kh/en,,
KRINC,,E1CTC,E1 CONTAINER TERMINAL,E1 CONTAINER TERMINAL,"N 37°26'23""","E 126°36'39""",37.439722,126.610833,2020-01-24,2018-12-18,,http://www.e1ct.co.kr/homepage/Eng/center_eng.asp,,See also https://www.icpa.or.kr/eng/content/view.do?menuKey=637&contentKey=145
KRINC,,HJITC,HANJIN INCHEON CONTAINER TERMINAL (HJIT),HANJIN INCHEON CONTAINER TERMINAL,"N 37°20'32""","E 126°37'38""",37.342222,126.627222,2020-01-24,2019-01-17,,http://www.hjit.co.kr/eng/Main.do,,See also https://www.icpa.or.kr/eng/content/view.do?menuKey=637&contentKey=146
KRINC,,ICTPC,INCHEON CONTAINER TERMINAL (ICT),"INCHEON CONTAINER TERMINALS CO., LTD. / PSA","N 37°26'19""","E 126°35'52""",37.438611,126.597778,2020-01-24,2018-12-18,,https://www.psa-ict.co.kr/eng/main/main.psa,,See also https://www.icpa.or.kr/eng/content/view.do?menuKey=637&contentKey=147
KRINC,,SNCTC,SUNKWANG NEWPORT CONTAINER TERMINAL (SNCT),"SUNKWANG NEWPORT CONTAINER TERMINAL CO., LTD.","N 37°20'32""","E 126°38'11""",37.342222,126.636389,2020-01-24,2018-12-18,,http://snct.sun-kwang.co.kr/eng/page/terminal05.jsp,,See also https://www.icpa.or.kr/eng/content/view.do?menuKey=637&contentKey=148
KRKAN,,GWCT,GWANGYANG WEST CONTAINER TERMINAL,"GWANGYANG WEST CONTAINER TERMINAL CO., LTD.","N 34°53'47""","E 127°39'19""",34.896389,127.655278,,2018-12-18,,https://www.cjlogistics.com,"1392, Hwang Gil Dong, Gwang Yang, Chonnam, South Korea",
KRKAN,,KIT,KOREA INTERNATIONAL CONTAINER TERMINAL,KOREA INTERNATIONAL TERMINAL,"N 34°54'09""","E 127°39'59""",34.9025,127.666389,,2015-05-03,,https://www.kitl.com/eng/index.kitl,"240, Keonbudu-ro, Gwangyang-si, Jeollanam-do, South Korea",
KRKAN,,GIGCT,SM GWANGYANG TERMINAL,"SM LINE GWANGYANG TERMINAL CO., LTD.","N 34°54'34""","E 127°40'38""",34.909444,127.677222,,2018-12-18,,http://home.smlgt.co.kr/home,"390, Keonbudu-ro, Gwangyang-si, Jeollanam-do, South Korea",
KRKPO,,PICTC,POHANG INTERNATIONAL CONTAINER TERMINAL (PICT),POHANG YEONGILMAN SHINHANG PORT CO.,"N 36°06'20""","E 129°26'21""",36.105556,129.439167,2020-01-24,2018-12-18,,http://www.pohangport.com/eng/main.html,,
KRPTK,,PCTCC,PYEONGTAEK CONTAINER TERMINAL,PYEONGTAEK CONTAINER TERMINAL CO,"N 36°57'53""","E 126°50'21""",36.964722,126.839167,,2018-12-18,,http://www.pctc21.com/eng,,
KRPTK,,PNCTC,PYEONGTAEK DONGBANG I-PORT,"PYEONGTAEK DONGBANG I-PORT CO., LTD.","N 36°57'02""","E 126°51'03""",36.950556,126.850833,,2018-12-18,,http://www.pnct.co.kr/homepage/eng/page/com_directions.jsp,"Dongnam Building 2F, 7-10, UnJeong-ri, HyunDeok-myun, Pyeongtaek-si, GyeongGi-do, South Korea",
KRPUS,,BNCT,BUSAN NEW CONTAINER TERMINAL (BNCT),"BUSAN NEW CONTAINER TERMINAL CO., LTD.","N 35°04'04""","E 128°48'46""",35.067778,128.812778,2020-01-24,2015-03-06,,http://www.bnctkorea.com/,"586, Sinhangnam-ro, (Seongbuk-dong), Gangseo-gu, Busan, South Korea",New Port Pier 5
KRPUS,,KBCT,BUSAN PORT TERMINAL (BPT),BUSAN PORT TERMINAL,"N 35°06'20""","E 129°05'42""",35.105556,129.095,2018-01-13,2004-05-31,,http://info.bptc.co.kr/,,Sinseondae pier and Gamman pier
KRPUS,,DPCT,DONGBU PUSAN CONTAINER TERMINAL (DPCT),"DONGBU PUSAN CONTAINER TERMINAL CO., LTD.","N 35°06'22""","E 129°04'16""",35.106111,129.071111,2020-01-24,2004-05-31,,http://www.dpct.co.kr/,,Sin-gamman Pier
KRPUS,KRBNP,HJNC,HANJIN BUSAN NEW PORT CO. (HJNC),HANJIN BUSAN NEW PORT CO.,"N 35°04'40""","E 128°47'28""",35.077778,128.791111,2020-01-24,2015-03-06,,http://www.hjnc.co.kr/ENG/intro.aspx,,New Port Pier 3
KRPUS,,HBCT,HUTCHISON BUSAN CONTAINER TERMINAL (HBCT),HUTCHISON PORTS BUSAN,"N 35°07'22""","E 129°03'37""",35.122778,129.060278,2020-01-24,2015-03-25,,https://www.hktl.com/main/main.php,"314, Chungjang-daero, Dong-gu, Busan, South Korea",Jaseongdae pier
KRPUS,,HPNT,PSA HYUNDAI PUSAN NEW-PORT TERMINAL (HPNT),PSA HYUNDAI PUSAN NEW-PORT TERMINAL CO.,"N 35°04'12""","E 128°49'35""",35.07,128.826389,2020-01-24,2015-03-06,,https://www.hpnt.co.kr/homepage/eng/webpage/,,New Port Pier 4
KRPUS,,PNC,PUSAN NEW PORT CO. (PNC),PUSAN NEW PORT CO.,"N 35°04'40""","E 128°48'27""",35.077778,128.8075,2020-02-29,2004-05-31,,https://pncport.com/eng/,,New Port Pier 2
KRPUS,,PNP,PUSAN NEW PORT INTERNATIONAL TERMINAL (PNIT),PUSAN NEW PORT INTERNATIONAL TERMINAL CO.,"N 35°04'40""","E 128°49'31""",35.077778,128.825278,2020-02-29,2004-05-31,,https://www.pnitl.com/infoservice/main/mainPage.jsp,,New Port Pier 1
KRUSN,,JUCTC,JEONG IL ULSAN CONTAINER TERMINAL,"JEONG IL ULSAN CONTAINER TERMINAL CO., LTD","N 35°26'32""","E 129°21'10""",35.442222,129.352778,,2018-12-18,,https://www.juct.co.kr/,"150-5 Sanam-ri, Onsan-eup, Ulju-gun, Ulsan, South Korea",
KRUSN,,UDITC,ULSAN NEWPORT CONTAINER TERMINAL (UNCT),"ULSAN NEWPORT CONTAINER TERMINAL CO., LTD","N 35°27'20""","E 129°21'55""",35.455556,129.365278,2020-01-24,2018-12-18,,http://www.unct.co.kr/,"625-1 Hwangseong-dong, Nam-gu, Ulsan, South Korea",
KWSAA,,SAACT,SHUAIBA CONTAINER TERMINAL,GLOBAL CLEARINGHOUSE SYSTEMS COMPANY,"N 29°02'45""","E 048°09'17""",29.045833,48.154639,,2020-06-08,,https://www.gcskw.com/,"Shuaiba Container Terminal, berths no. 15,16,17,18. Eastern Road, Kuwait","Berths 15,16,17,18"
KWSWK,,SWKCT,SHUWAIKH CONTAINER TERMINAL,JASSIM TRANSPORT & STEVEDORING COMPANY,"N 29°20'56""","E 047°55'15""",29.348833,47.920778,,2020-06-08,,http://www.jtckw.com/,"Shuwaikh Container Terminal, berths No. 10 & 13","Berths 10,12,13"
LBBEY,,BCTC,BEIRUT CONTAINER TERMINAL CONSORTIUM (BCTC),BEIRUT CONTAINER TERMINAL CONSORTIUM S.A.L.,"N 33°54'32""","E 035°32'03""",33.908889,35.534167,,2004-05-31,,https://www.bctc-lb.com/,,
LKCMB,,CICT,COLOMBO INTERNATIONAL CONTAINER TERMINAL,COLOMBO INTERNATIONAL CONTAINER TERMINALS LTD.,"N 06°56'44""","E 079°49'58""",6.945556,79.832778,2020-01-24,2015-06-20,,http://www.cict.lk/,,
LKCMB,,LKJCT,JAYA CONTAINER TERMINAL,JAYA CONTAINER TERMINAL,"N 06°56'52""","E 079°51'10""",6.947778,79.852778,2020-01-24,2005-09-19,,http://portcom.slpa.lk/Jaya_container_terminal.asp?chk=6,,
LKCMB,,SAGT,SOUTH ASIA GATEWAY TERMINALS (SAGT),SOUTH ASIA GATEWAY TERMINALS PVT. LTD.,"N 06°56'48""","E 079°50'44""",6.946667,79.845556,2020-01-24,2005-09-19,,https://www.sagt.com.lk/,,
LKCMB,,LKUCT,UNITY CONTAINER TERMINAL,UNITY CONTAINER TERMINAL,"N 06°57'30""","E 079°51'18""",6.958333,79.855,2020-01-24,2005-09-19,,http://portcom.slpa.lk/unity_container_terminal.asp?chk=6,,
LTKLJ,,KKT,KLAIPEDA CONTAINER TERMINAL,KLAIPEDOS KONTEINERIU TERMINALAS,"N 55°38'45""","E 021°09'36""",55.645833,21.16,2020-07-01,2014-11-10,,https://www.terminalas.lt/?lang=en,"Minijos st. 180, LT-93269 Klaipeda, Lithuania","Berths 143,143a"
LTKLJ,,KAS,KLAIPEDA SMELTE CONTAINER TERMINAL (KSCT),KLAIPEDOS SMELTE,"N 55°40'40""","E 021°08'34""",55.677778,21.142778,2020-07-01,2014-11-10,,http://www.smelte.lt/index.php/en/,"Nemuno str. 24, LT-93278 Klaipeda, Lithuania",Berths 82-96
LVRIX,,BCT,BALTIC CONTAINER TERMINAL RIGA,BALTIC CONTAINER TERMINAL,"N 57°00'26""","E 024°05'48""",57.007222,24.096667,2020-02-29,2007-11-10,,http://www.bct.lv/,"Uriekstes iela 32, Riga, LV-1005, Latvia",
LVRIX,,RCT,RIGA CONTAINER TERMINAL (RIGACT),RIGA CONTAINER TERMINAL (RIGACT),"N 56°58'51""","E 024°05'37""",56.980833,24.093611,2020-02-29,2008-01-16,,https://www.rigact.lv/en/,"15 K-1 Eksporta Iela, Riga, LV-1045, Latvia",
LVRIX,,RUT,RIGA UNIVERSAL TERMINAL,RIGA UNIVERSAL TERMINAL,"N 57°02'31""","E 024°04'34""",57.041944,24.076111,2020-02-29,2014-11-12,,http://www.ruterminal.lv/,"Birztalu iela 15, Riga, LV-1015, Latvia",
MACAS,,EST,CONTAINER TERMINAL EST,MARSA MAROC,"N 33°36'36""","W 007°35'46""",33.61,-7.596111,2020-02-29,2005-10-07,,http://www.marsamaroc.co.ma/en/espace-corporate/casablanca,,
MACAS,,SOMAP,SOMAPORT,SOMAPORT,"N 33°36'17""","W 007°36'15""",33.604722,-7.604167,2020-02-29,2015-06-12,,https://www.somaport.ma/en/design-terminal-tp,,
MAPTM,,APMT,APM TERMINALS TANGIER,APM TERMINALS TANGIER,"N 35°53'24""","W 005°29'48""",35.89,-5.496667,2021-01-01,2018-02-19,,https://www.apmterminals.com/en/tangier,"Zone Franche Ksar Al Majaz, Oued R'Mel, Commune Anjra, Route de Fnideq, BP 216, Ksar es-Seghir, Morocco","Locally known as ""TC1"""
MAPTM,,APM2,APM TERMINALS TANGIER MEDPORT 2,APM TERMINALS TANGIER,"N 35°51'47""","W 005°32'18""",35.863056,-5.538333,,2019-08-22,,https://www.apmterminals.com/en/medport-tangier,"Port de Tanger Med, Ksar es-Seghir, Morocco","Locally known as ""TC4"""
MAPTM,,EURTN,EUROGATE TANGIER,EUROGATE TANGIER S.A,"N 35°53'43""","W 005°29'26""",35.895278,-5.490556,2019-12-13,2004-05-31,,http://www1.eurogate.de/en/Terminals/Tangier,"Zone Franche Ksar Al Majaz, Oued R'Mel, Commune Anjra, Route de Fnideq, 90000 Tangier, Morocco","Locally known as ""TC2"""
MAPTM,,TAT,TANGER ALLIANCE TERMINAL,"TANGER ALLIANCE (MARSA MAROC, EUROGATE)","N 35°52'32""","W 005°31'32""",35.875611,-5.525528,,2021-01-01,,https://www.contshipitalia.com/en/subsidiaries/tanger-alliance,"Zone Franche Ksar Al Majaz, Terminal à Conteneurs 3, Port Tanger 2, Tanger, Morocco","Locally known as ""TC3"""
MMRGN,,AIPT1,AHLONE INTERNATIONAL PORT TERMINAL 1,MYANMAR PORT AUTHORITY,"N 16°47'07""","E 096°07'10""",16.785278,96.119444,,2019-12-13,,https://www.aipt1.com,"Ahlone Road, Ahlone Township, Yangon, Myanmar",
MMRGN,,AWPT,ASIA WORLD PORT TERMINAL,ASIA WORLD PORT MANAGEMENT CO. LTD.,"N 16°47'34""","E 096°07'12""",16.792778,96.12,,2019-12-13,,https://www.asiaworldcompany.com,"No. 61-62, Bahosi Development, Wadan Street, Lanmadaw Township, Yangon, Myanmar",
MMRGN,,BAKT,BO AUNG KYAW TERMINAL,LANN PYI MARINE CO. LTD,"N 16°46'00""","E 096°09'57""",16.766667,96.165833,,2019-12-13,,http://lpm-myanmar.com,"No. 55/61, Strand Road, Seikkan Township, Yangon, Myanmar",
MMRGN,,MIP,MYANMAR INDUSTRIAL PORT (MIP),MYANMAR INDUSTRIAL PORT (MIP) CONTAINER TERMINAL ,"N 16°46'34""","E 096°07'56""",16.776111,96.132222,,2019-11-18,,https://www.myanmarindustrialport.com/index,"No. 7/2 (B) Strand Road, Ahlone Township, Yangon, Myanmar.",
MMRGN,,MITT,MYANMAR INTERNATIONAL TERMINALS THILAWA (HUTCHISON MITT),MYANMAR INTERNATIONAL TERMINALS THILAWA LTD. (HUTCHISON MITT),"N 16°39'59""","E 096°15'01""",16.666389,96.250278,,2019-12-13,,https://www.mitt.com.mm,"Thilawa, Kyauktan Township, Yangon, Myanmar","Subsidiary company of CK Hutchison Holdings, Hong Kong"
MRNKC,,PANPA,FRIENDSHIP PORT OF NOUAKCHOTT,PORT AUTONOME DE NOUAKCHOTT - PORT DE L'AMITIE (PANPA),"N 17°59'27""","W 016°02'05""",17.990833,-16.034722,,2020-06-08,,http://www.port-nouakchott.com/,,
MTMAR,,FREE,MALTA FREEPORT TERMINALS LTD,MALTA FREEPORT TERMINALS LTD.,"N 35°49'12""","E 014°32'34""",35.82,14.542778,,2004-05-31,,,,
MXATM,,ATP,ALTAMIRA TERMINAL PORTUARIA,ALTAMIRA TERMINAL PORTUARIA S.A. DE C.V.,"N 22°28'37""","W 097°53'06""",22.476944,-97.885,,2004-05-31,,https://www.atpaltamira.com.mx/,"Carretera Terminal de usos multiples s/n, Local 1, Puerto de Altamira, 89603 Altamira, Tamaulipas, Mexico",
MXATM,,IPM,INFRAESTRUCTURA PORTUARIA MEXICANA S.A. DE C.V.,INFRAESTRUCTURA PORTUARIA MEXICANA S.A. DE C.V.,"N 22°28'26""","W 097°53'03""",22.473889,-97.884167,,2004-05-31,,http://www.ipmaltamira.com.mx/ipm/english/,"Blvd. Golfo De Mexico S/N, Puerto Industrial, 89603 Altamira, Tamaulipas, Mexico",
MXESE,,EIT,ENSENADA INTL TERMINAL SA DE CV,ADMINISTRACION PORTUARIA INTEGRAL DEENSENADA S.A. DE C.V.,"N 31°51'06""","W 116°37'45""",31.851667,-116.629167,,2004-05-31,,http://hutchisonportseit.com/en/,"Blvd. Tte. José Azueta No. 224 Int Recinto Portuario, 22800 Ensenada, Baja California, Mexico",
MXLZC,,APMT,APM TERMINALS LAZARO CARDENAS TERMINAL DE CONTENEDORES II,APM TERMINALS LAZARO CARDENAS S.A. DE C.V.,"N 17°58'28""","W 102°10'21""",17.974444,-102.1725,,2017-11-07,,https://www.apmterminals.com/en/lazaro-cardenas,"Interior Recinto Portuario S/N Puerto, 60950 Lázaro Cárdenas, Michoacán, Mexico",
MXLZC,,LCT,LAZARO CARDENAS TERMINAL PORTUARIA I,"LAZARO CARDENAS TERMINAL PORTUARIA DE CONTENEDORES, S.A. DE C.V.","N 17°57'12""","W 102°10'18""",17.953333,-102.171667,,2004-05-31,,https://hutchisonportslct.com/en/,"Boulevard de Las Islas no.1 módulo 14, Colonia Isla del Cayacal, 60950 Lázaro Cárdenas, Michoacán, Mexico",
MXMZT,,TMAZ,TERMINAL MARITIMA DE MAZATLAN,TERMINAL MARITIMA DE MAZATLAN,"N 23°11'36""","W 106°24'54""",23.193333,-106.415,2020-01-24,2016-06-06,,https://www.tmaz.com.mx/english/,"Av. Emilio Barragán S/N Col. Centro, Interior Recinto Fiscalizado, 82000 Mazatlán, Sinaloa, Mexico",
MXPGO,,TCY,ADMINISTR. PORTUARIA INTEGRAL DE PROGRESO,TERMINAL DE CONTENEDORES DE YUCATAN S.A. DE C.V.,"N 21°20'46""","W 089°40'38""",21.346111,-89.677222,,2004-05-31,,https://www.apmterminals.com/en/progreso,"Terminal Remota, Puerto de Altura, 97320 Progreso, Yucatán, Mexico",
MXTAP,,PMD,PUERTO CHIAPAS,PUERTO CHIAPAS,"N 14°42'38""","W 092°24'05""",14.710556,-92.401389,2020-02-29,2016-09-12,,http://www.puertochiapas.com.mx/,,
MXTUX,,TPT,TUXPAN PORT TERMINAL,TUXPAN PORT TERMINAL S.A. DE C.V.,"N 20°57'29""","W 097°19'32""",20.958056,-97.325556,,2019-10-04,,https://www.tpt.mx/,"Carretera La Barra Sur, Km 7+800, Tuxpan, Veracruz, Mexico",
MXVER,,ICAVE,INTERNACIONAL DE CONTENEDORES ASOCIADOS DE VERACRUZ (ICAVE) TEC II,INTERNACIONAL DE CONTENEDORES ASOCIADOS DE VERACRUZ S.A. DE C.V. (HUTCHISON),"N 19°14'20""","W 096°10'12""",19.239019,-96.169975,,2020-01-01,,https://hutchisonportsicave.com/en/,"Terminal Especializada de Contenedores, Zona de Ampliación del Nuevo Puerto de Veracruz, Mexico",
MXZLO,,CMSA,CONTECON MANZANILLO,CONTECON MANZANILLO S.A. DE C.V.,"N 19°05'05""","W 104°18'09""",19.084722,-104.3025,,2016-05-13,,http://www.contecon.mx,"Blvd. Miguel de la Madrid Hurtado S/N, Colonia Las Brisas primera sección, TEC ll Zona Norte, 28239 Manzanillo, Colima, Mexico",
MXZLO,,SSAMX,SSA MEXICO HOLDINGS,SSA MEXICO HOLDINGS S.A. DE C.V.,"N 19°04'20""","W 104°17'27""",19.072222,-104.290833,,2004-05-31,,https://www.ssamarine.com/locations/manzanillo-colima/,,
MXZLO,,TIMSA,TERMINAL INTL DE MANZANILLO (TIMSA),TERMINAL INT DE MANZANILLO S.A. DE C.V. TIMSA,"N 19°03'37""","W 104°17'35""",19.060278,-104.293056,,2004-05-31,,http://hutchisonportstimsa.com/en/,,
MYPEN,,PENP,PENANG PORT,PENANG PORT SDN. BHD.,"N 05°25'18""","E 100°22'02""",5.421667,100.367222,,2014-07-10,,http://www.penangport.com.my/,"NBCT Penang Port, 12200 Butterworth, Penang, Malaysia",
MYPGU,,JPB,JOHOR PORT,JOHOR PORT BERHAD,"N 01°26'14""","E 103°53'23""",1.437222,103.889722,2019-12-13,2015-06-12,,http://www.johorport.com.my,"Pasir Gudang Industrial Estate, 81707 Pasir Gudang, Johor, Malaysia",
MYPKG,,NPM,NORTHPORT MALAYSIA,NORTHPORT MALAYSIA BHD.,"N 03°02'14""","E 101°21'26""",3.037222,101.357222,,2004-05-31,,https://www.northport.com.my,"Jalan Pelabuhan, Pelabuhan Utara, 42000 Port Klang, Selangor, Malaysia",
MYPKG,,KMT,WESTPORT KELANG MULTI TERMINAL (KMT),WESTPORTS MALAYSIA SDN. BHD.,"N 02°56'06""","E 101°17'42""",2.935,101.295,2020-01-24,2004-05-31,,https://www.westportsholdings.com/,"P.O. Box 266, Pulau Indah, 42009 Port Klang, Selangor, Malaysia",
MYTPP,,PTP,PORT OF TANJUNG PELEPAS (PTP),PORT OF TANJUNG PELEPAS SDN. BHD.,"N 01°21'45""","E 103°32'45""",1.3625,103.545833,,2004-05-31,,https://www.ptp.com.my/,"Block A, Wisma PTP, Jalan Pelabuhan Tanjung Pelepas TST 507, 81560 Gelang Patah, Johor, Malaysia",
MZMPM,,MIPS,DP WORLD MAPUTO,DP WORLD,"S 25°57'42""","E 032°32'46""",-25.961667,32.546111,2020-01-24,2005-09-19,,http://www.dpworldmaputo.com/,,MIPS was renamed to DP World Maputo in 2008
NAWVB,,WVB,WALVIS BAY OCEAN TERMINAL,WALVIS BAY OCEAN TERMINAL,"S 22°57'04""","E 014°29'48""",-22.951111,14.496667,2020-01-24,2015-09-22,,https://www.namport.com.na/ports/welcome-to-the-port-of-walvis-bay/522/,,
NGAPP,,APMTER,APM TERMINALS APAPA,APM TERMINALS APAPA LTD.,"N 06°26'09""","E 003°23'18""",6.435833,3.388333,2020-01-24,2015-10-09,,https://www.apmterminals.com/apapa,,
NGPHC,NGONN,APMT,WEST AFRICA CONTAINER TERMINAL (ONNE PORT COMPLEX),APM TERMINALS,"N 04°42'15""","E 007°09'20""",4.704167,7.155556,,2018-09-05,,https://www.apmterminals.com/en/operations/africa-middle-east/onne,,
NGTIN,,FIVEST,FIVE STAR TERMINAL TIN CAN ISLAND (TERMINAL D),FIVE STAR (TIN CAN ISLAND),"N 06°25'47""","E 003°20'27""",6.429722,3.340833,2020-12-01,2015-09-22,,https://www.fivestarlogisticsltd.com/,,"Berths 9,10"
NGTIN,,TICT,TIN CAN ISLAND CONTAINER TERMINAL TICT (TERMINAL B),TIN CAN ISLAND TERMINAL LTD. / BOLLORE PORTS,"N 06°25'57""","E 003°21'09""",6.4325,3.3525,2020-12-01,2015-09-22,,https://www.tict-ng.com/,,"Berths 3,4,4A,5"
NGTIN,,TCIPC,TIN CAN ISLAND PORT (TERMINAL C),PORTS & CARGO HANDLING SERVICES LTD.,"N 06°25'52""","E 003°20'46""",6.431111,3.346111,,2020-12-01,,http://www.sifaxgroup.com/companies/ports-and-cargo-handling-services-limited/,"Tin-Can Island Port Terminal C, 1st Gate, Tin-Can Island, Lagos, Nigeria","Berths 6,7,7A,8"
NICIO,,EPN,PORT OF CORINTO,EMPRESA PORTUARIA NACIONAL,"N 12°28'57""","W 087°10'04""",12.4825,-87.167778,,2004-05-31,,,,
NLAMS,,ACT,AMSTERDAM CONTAINER TERMINAL (ACT),AMSTERDAM CONTAINER TERMINALS BV,"N 52°25'19""","E 004°46'01""",52.421944,4.766944,2020-01-24,2009-03-20,,https://hutchisonports.com/en/ports/world/amsterdam-container-terminals-act/,"Ruijgoordweg 100, Harbor number 7991, 1047 HM Amsterdam, The Netherlands",
NLRTM,,APM,APM TERMINALS ROTTERDAM,APM TERMINALS,"N 51°57'27""","E 004°02'45""",51.9575,4.045833,2019-11-18,2014-08-05,,https://www.apmterminals.com/en/rotterdam,"Coloradoweg 50, Port number 8203, 3199 LA Maasvlakte-Rotterdam, The Netherlands",
NLRTM,,NLMVII,APM TERMINALS ROTTERDAM MAASVLAKTE 2,APM TERMINALS,"N 51°57'15""","E 004°00'12""",51.954167,4.003333,2019-11-18,2014-08-26,,https://www.apmterminals.com/en/maasvlakte,"Europaweg 910, Port number 8410, 3199 LC Maasvlakte-Rotterdam, The Netherlands",
NLRTM,,RTMB,BARGE CENTER WAALHAVEN (BCW),RTM-BARGE CENTER-WAALHAVEN,"N 51°52'54""","E 004°26'08""",51.881667,4.435556,2019-11-18,2005-02-23,,https://www.bargecenterwaalhaven.nl,"Waalhaven West Zijde 62, Port number 2503, 3089 KR Rotterdam, The Netherlands",
