UNLOCODE,Alternative UNLOCODEs,Terminal Code,Terminal Facility Name,Terminal Company Name,Latitude (DMS),Longitude (DMS),Latitude,Longitude,Last change,Valid from,Valid until,Terminal Website,Terminal Address,Remarks
NLRTM,,5049,BERTH 5049,HOLLAND TERMINALS,"N 51°52'47""","E 004°14'23""",51.879722,4.239722,2019-11-18,2005-08-24,,https://www.waalhavenbotlekterminal.nl/terminal/,"Nieuwesluisweg 268, Port number 5049, 3197 KV Rotterdam, The Netherlands",
NLRTM,,DBF,ECT DELTA BARGE FEEDER TERMINAL (DBF),ECT DELTA TERMINAL,"N 51°57'20""","E 004°04'30""",51.955556,4.075,2019-11-18,2007-10-25,,https://www.ect.nl,"Europaweg 875, Port number 8200, 3199 LD Rotterdam (Maasvlakte), The Netherlands",
NLRTM,,DDE,ECT DELTA DEDICATED EAST (DDE),ECT DELTA TERMINAL,"N 51°57'01""","E 004°03'51""",51.950278,4.064167,2019-11-18,2007-10-25,,https://www.ect.nl,"Europaweg 875, Port number 8200, 3199 LD Rotterdam (Maasvlakte), The Netherlands",
NLRTM,,DDN,ECT DELTA DEDICATED NORTH (DDN),ECT DELTA TERMINAL,"N 51°57'32""","E 004°03'53""",51.958889,4.064722,2019-11-18,2007-10-25,,https://www.ect.nl,"Europaweg 875, Port number 8200, 3199 LD Rotterdam (Maasvlakte), The Netherlands",
NLRTM,,DCD,ECT DELTA TERMINAL GATE,ECT DELTA TERMINAL,"N 51°57'16""","E 004°01'43""",51.954583,4.028639,2019-11-18,2016-06-02,,https://www.ect.nl,"Europaweg 875, Port number 8200, 3199 LD Rotterdam (Maasvlakte), The Netherlands",Previously DELTA CONTAINER DIVISION (DCD).
NLRTM,,EMX,ECT EUROMAX TERMINAL (EMX),ECT EUROMAX TERMINAL BV,"N 51°58'27""","E 004°02'17""",51.974167,4.038056,2019-11-18,2007-10-25,,https://www.ect.nl,"Maasvlakteweg 951, Port number 9830, 3199 LZ Rotterdam (Maasvlakte), The Netherlands",
NLRTM,,INTER,INTERFOREST TERMINAL ROTTERDAM,INTERFOREST TERMINAL ROTTERDAM,"N 51°52'54""","E 004°23'57""",51.881667,4.399167,2019-11-18,2014-08-05,,https://www.matransrotterdamterminal.com,"Streefwaalseweg 15, 3195 KN Pernis Rotterdam, The Netherlands",
NLRTM,,RSC,RAIL SERVICE CENTER ROTTERDAM,RAIL SERVICE CENTER ROTTERDAM,"N 51°52'20""","E 004°25'42""",51.872222,4.428333,2019-11-18,2008-11-19,,https://www.rscrotterdam.nl,"Albert Plesmanweg 200, 3088 GD Rotterdam (hoofdkantoor)",
NLRTM,,KRM,ROTTERDAM CONTAINER TERMINAL (RCT) MAASVLAKTE,KRAMER TERMINAL,"N 51°56'45""","E 004°01'58""",51.945833,4.032778,2019-11-18,2014-08-05,,https://www.kramergroup.nl/rotterdam-container-terminal-rct/,"Missouriweg 17, Port number 7220, 3199 LB Maasvlakte-Rotterdam, The Netherlands",
NLRTM,,RSN,ROTTERDAM SHORT SEA TERMINAL (RST) NORTH SIDE,ROTTERDAM SHORT SEA TERMINALS,"N 51°52'49""","E 004°25'25""",51.880278,4.423611,2019-11-18,2014-08-05,,https://rstshortsea.nl,"Reeweg 35, Port number 2750, 3089 KM Rotterdam, The Netherlands",
NLRTM,,RSZ,ROTTERDAM SHORT SEA TERMINAL (RST) SOUTH SIDE,ROTTERDAM SHORT SEA TERMINALS,"N 51°52'41""","E 004°25'12""",51.878056,4.42,2019-11-18,2014-08-05,,https://rstshortsea.nl,"Reeweg 35, Port number 2750, 3089 KM Rotterdam, The Netherlands",
NLRTM,,NLSBH,ROTTERDAM STEINWEG BEATRIXHAVEN,STEINWEG BEATRIXHAVEN,"N 51°53'01""","E 004°24'50""",51.883611,4.413889,2019-11-18,2015-11-01,,https://netherlands.steinweg.com/en/beatrix-terminal/,"Den Hamweg 30, Port number 2732, 3089 KK Rotterdam, The Netherlands",
NLRTM,,RWG,ROTTERDAM WORLD GATEWAY,ROTTERDAM WORLD GATEWAY,"N 51°57'12""","E 003°59'28""",51.953333,3.991111,2019-11-18,2014-08-05,,https://www.rwg.nl,"Amoerweg 50, Port number 8970, 3199 KD Maasvlakte 2 Rotterdam, The Netherlands",
NLRTM,,UMTR,UNIPORT WAALHAVEN TERMINAL,UNIPORT MULTIPURPOSE TERMINALS B.V.,"N 51°53'21""","E 004°25'38""",51.889167,4.427222,2019-11-18,2016-05-13,,https://www.uniport.nl,"Terminal Pier 5, 6 & 7 Waalhaven, Zaltbommelstraat 10, Port number 2530, 3089 JK Rotterdam, The Netherlands",
NLRTM,,DRN,VAN DOORN DEPOT ROTTERDAM,VAN DOORN DEPOT,"N 51°56'23""","E 004°00'33""",51.939722,4.009167,2019-11-18,2014-10-14,,https://dr-depots.com/,"Malakkastraat 51, Port number 8564, 3199 LK Maasvlakte-Rotterdam, The Netherlands",
NLVLI,,KBV,KLOOSTERBOER VLISSINGEN B.V.,KLOOSTERBOER VLISSINGEN B.V.,"N 51°28'30""","E 003°42'28""",51.475,3.707778,,2018-01-22,,https://www.kloosterboer.com,,
NLVLI,,VZT,VERBRUGGE ZEELAND TERMINALS BV,VERBRUGGE ZEELAND TERMINALS BV,"N 51°27'51""","E 003°41'12""",51.464167,3.686667,,2019-02-27,,https://www.verbrugge.nl,,
NOAES,,SKUTVI,SKUTVIKA TERMINAL,TYRHOLM & FARSTAD AS,"N 62°28'07""","E 006°08'15""",62.468611,6.1375,2020-02-29,2015-03-25,,http://www.alesund.havn.no/en/Webkamera/Skutvika-havneanlegg,,
NOFRK,,OERK,BORG HAVN FREDRIKSTAD-OERA,BORG HAVN IKS,"N 59°10'58""","E 010°57'15""",59.182778,10.954167,2020-02-29,2007-11-10,,https://www.borg-havn.no/gods-fredrikstad/,"Øraveien 27, N-1630 Gamle Fredrikstad, Norway",
NOLAR,,NOLCT,LARVIK CONTAINER TERMINAL,LARVIK CONTAINER TERMINAL AS,"N 59°02'20""","E 010°02'28""",59.038889,10.041111,2020-02-29,2006-01-30,,https://larvik.havn.no/en/,"Revet, 3263 Larvik, Norway",
NOMSS,,MCT,MOSS CONTAINER TERMINAL,MOSS CONTAINER TERMINAL AS,"N 59°25'37""","E 010°39'26""",59.426944,10.657222,2020-02-29,2009-09-28,,https://www.moss-havn.no/en-GB/Portarea/ports,"Strandgaten 10, 1531 Moss, Norway",
NOOSL,,NSF,FILIPSTAD QUAY,NORSTEVE AS,"N 59°54'26""","E 010°42'55""",59.907222,10.715278,2020-02-29,2008-01-16,,http://oslohavn.no/no/meny/tjenester/kart-over-oslo-havn/,,
NOOSL,,SCT,SJURSOYA SOUTH QUAY,YILPORT OSLO A/S,"N 59°53'11""","E 010°45'08""",59.886389,10.752222,2020-02-29,2008-01-16,,https://www.yilport.com/en/ports/default/Oslo-Norway-%7C-Nordic-Terminals/86/0/0,"Sjursøya 9, 0193 Oslo, Norway",
NOTAE,,RIS,WESTPORT TERMINAL RISAVIKA,RISAVIKA TERMINAL AS,"N 58°55'10""","E 005°35'12""",58.919444,5.586667,2020-04-01,2015-03-25,,http://westport.no/,"Kontinentalveien 19, 4056 Tananger, Norway",
NZAKL,,PABW,PORTS OF AUCKLAND BLEDISLOE WHARF,PORTS OF AUCKLAND LIMITED,"S 36°50'30""","E 174°46'21""",-36.841667,174.7725,,2004-05-31,,https://www.poal.co.nz/,"Tinley Street, Auckland 1010, New Zealand","Berths B1,B2,B3"
NZAKL,,PAFW,PORTS OF AUCKLAND FERGUSSON WHARF,PORTS OF AUCKLAND LIMITED,"S 36°50'27""","E 174°47'00""",-36.840833,174.783333,,2004-05-31,,https://www.poal.co.nz/,"Tamaki Street, Auckland 1010, New Zealand","Berths FX,FY,FZ"
NZAKL,,PAGW,PORTS OF AUCKLAND GENERAL WHARF,PORTS OF AUCKLAND LIMITED,"S 36°50'33""","E 174°46'45""",-36.8425,174.779167,,2004-05-31,,https://www.poal.co.nz/,,
NZLYT,,LPC,LYTTELTON PORT COMPANY,LYTTELTON PORT COMPANY LIMITED,"S 43°36'32""","E 172°43'42""",-43.608889,172.728333,,2004-05-31,,http://www.lpc.co.nz/,"Cashin Quay, 2, Lyttelton 8082, New Zealand",
NZNPE,,NPENZ,NAPIER PORT,PORT OF NAPIER LTD.,"S 39°28'31""","E 176°55'01""",-39.475278,176.916944,2020-01-03,2005-08-02,,https://www.napierport.co.nz/,"818 Breakwater Road, Bluff Hill, Napier 4110, New Zealand",
NZNPL,,PTAR,PORT TARANAKI,PORT TARANAKI LTD.,"S 39°03'25""","E 174°02'03""",-39.056944,174.034167,,2014-07-10,,https://www.porttaranaki.co.nz/,"2/8 Bayly Road, Port Taranaki, New Plymouth 4340, New Zealand",
NZNSN,,PNEL,PORT NELSON,PORT NELSON LTD.,"S 41°15'41""","E 173°16'16""",-41.261389,173.271111,,2014-07-10,,http://www.portnelson.co.nz/,"8 Vickerman Street, Port Nelson, Nelson 7040, New Zealand",
NZPOE,,POOT,PORT CHALMERS,PORT OTAGO LTD.,"S 45°48'45""","E 170°37'33""",-45.8125,170.625833,2020-01-03,2014-02-06,,https://www.portotago.co.nz/marine-and-shipping/berth-facilities/,"15 Beach Street, Port Chalmers 9023, New Zealand",
NZTIU,,PTIM,PRIMEPORT TIMARU,PRIMEPORT TIMARU LTD.,"S 44°23'36""","E 171°15'29""",-44.393333,171.258056,2020-12-01,2014-07-10,,https://www.primeport.co.nz/home,"Maritime House, 1 Marine Parade, Timaru 7910, New Zealand","Wharfs 1,1X,2,3. Only for bulk and general cargo."
NZTIU,,TCTL,TIMARU CONTAINER TERMINAL,PORT OF TAURANGA LTD.,"S 44°23'19""","E 171°15'23""",-44.388611,171.256389,,2020-12-01,,http://www.timarucontainerterminal.co.nz/,"North Mole Central, Marine Parade, Timaru 7910, New Zealand","North Mole Wharf, Inner and Outer Berths."
NZTRG,,MMP,MOUNT MAUNGANUI PORT,PORT OF TAURANGA LTD.,"S 37°38'41""","E 176°10'56""",-37.644722,176.182222,2020-01-03,2004-05-31,,http://www.port-tauranga.co.nz/,"2 Salisbury Avenue, Mount Maunganui, Tauranga 3116, New Zealand",
NZTRG,,TRGCT,TAURANGA CONTAINER TERMINAL (SULPHUR POINT),PORT OF TAURANGA LTD.,"S 37°39'45""","E 176°10'29""",-37.6625,176.174722,2020-01-03,2005-08-03,,http://www.port-tauranga.co.nz/,"66 Mirrielees Road, Sulphur Point, Tauranga 3110, New Zealand",
NZWLG,,CPW,CENTREPORT WELLINGTON,CENTREPORT WELLINGTON,"S 41°16'44""","E 174°47'22""",-41.278889,174.789444,,2014-10-27,,https://www.centreport.co.nz/,"1 Hinemoa Street, Harbour Quays, Wellington 6011, New Zealand",
OMSLL,,APMT,APM TERMINALS SALALAH,APM TERMINALS,"N 16°56'29""","E 053°59'43""",16.941389,53.995278,,2018-10-05,,https://www.apmterminals.com/en/salalah,"PO Box 105, Postal Code 118, Muscat, Sultanate of Oman",
OMSOH,,OICT,OMAN INTERNATIONAL CONTAINER TERMINAL,OMAN INTERNATIONAL CONTAINER TERMINAL LLC,"N 24°30'54""","E 056°36'34""",24.515,56.609444,2020-01-03,2015-06-15,,http://www.oict.com.om/index.php,"Sohar Port and Free zone, PO Box 82, Postal Code 327, Sohar, Sultanate of Oman",
PABLB,,PPCBL,PPC CONTAINER TERMINAL BALBOA,HUTCHISON PORTS PPC,"N 08°57'36""","W 079°34'00""",8.96,-79.566667,2020-08-01,2004-05-31,,https://www.ppc.com.pa/,"Arnulfo Arias Madrid Ave., Bldg. 1501, Balboa, Ancon, Republic of Panama",
PACTB,,PCPPC,PPC CONTAINER TERMINAL CRISTOBAL,HUTCHISON PORTS PPC,"N 09°21'15""","W 079°54'32""",9.354167,-79.908889,2020-08-01,2004-05-31,,https://www.ppc.com.pa/,"6 Roosevelt Avenue & Terminal Street, Building #1010, P.O.Box 03420, Cristobal Colon, Republic of Panama",
PAMIT,,MIT,MANZANILLO INTERNATIONAL TERMINAL (MIT),MANZANILLO INTERNATIONAL TERMINAL PANAMA S.A.,"N 09°21'39""","W 079°53'00""",9.360833,-79.883333,2020-08-01,2004-05-31,,https://www.mitpan.com/en/,"Molten Avenue, South Coco Solo, P.O. Box 0302-00239, Colon Free Zone, Colon, Republic of Panama ",
PAONX,,CCT,COLON CONTAINER TERMINAL (CCT),COLON CONTAINER TERMINAL S.A.,"N 09°22'25""","W 079°53'20""",9.373611,-79.888889,,2020-10-01,,http://www.cct-pa.com/,"Randolph Road, Coco Solo North, Colon, Republic of Panama",
PAROD,,PPIT,PSA PANAMA INTERNATIONAL TERMINAL (PPIT),PSA PANAMA INTERNATIONAL TERMINAL S.A.,"N 08°57'29""","W 079°34'32""",8.958056,-79.575556,2020-08-01,2004-05-31,,https://www.psa.com.pa/,"Antigua Base Naval de Rodman, Cocoli, Arraiján, Republic of Panama",
PECLL,,APMCLL,APM TERMINALS CALLAO,APM TERMINALS CALLAO S.A.,"S 12°02'42""","W 077°08'39""",-12.045,-77.144167,2020-01-24,2015-02-23,,https://www.apmterminalscallao.com.pe/default.aspx,"Av. Contralmirante Raygada 111, Callao, Peru ",
PECLL,,DPCLL,DP WORLD CALLAO,DP WORLD CALLAO S.R.L.,"S 12°03'15""","W 077°08'58""",-12.054167,-77.149444,,2004-05-31,,https://www.dpworldcallao.com.pe/servicio/terminal-portuario/,"Av. Manco Cápac 113, Callao, Peru",
PEPAI,,TPE,TERMINALES PORTUARIOS EUROANDINOS (TPE),TERMINALES PORTUARIOS EUROANDINOSPAITA S.A.,"S 05°04'55""","W 081°06'31""",-5.081944,-81.108611,,2004-05-31,,http://puertopaita.com/,"Jr. Ferrocarril 127, Paita 20721, Peru",
PFPPT,,POPA,PORT OF PAPEETE,PORT AUTONOME DU PAPEETE,"S 17°32'14""","W 149°34'34""",-17.537222,-149.576111,,2004-05-31,,,,
PHCEB,,CIP,CEBU INTERNATIONAL PORT,CEBU INTERNATIONAL PORT,"N 10°18'33""","E 123°55'26""",10.309167,123.923889,2020-01-24,2015-06-12,,https://www.cpa.gov.ph/home,,
PHMNL,,MIC,MANILA INTERNATIONAL CONTAINER TERMINAL (MICT),"INTERNATIONAL CONTAINER TERMINAL SERVICES, INC. (ICTSI)","N 14°36'04""","E 120°57'16""",14.601111,120.954444,2020-01-24,2015-06-12,,https://www.mict.com.ph/#/mict-terminal,,
PHMNL,,NHDP,NORTH HARBOR DOMESTIC PORT,PORT OF MANILA,"N 14°36'57""","E 120°57'25""",14.615833,120.956944,2020-01-24,2015-06-12,,http://www.northport.ph/,,
PHMNL,,ATI,SOUTH HARBOR CONTAINER TERMINAL,ASIAN TERMINALS INC.,"N 14°35'11""","E 120°58'01""",14.586389,120.966944,2020-01-24,2005-09-19,,https://www.asianterminals.com.ph/ati_containerterminal.aspx,,
PKBQM,,QICT,QASIM INTERNATIONAL CONTAINER TERMINAL (QICT),QASIM INTERNATIONAL CONTAINER TERMINAL PAKISTAN LTD,"N 24°45'52""","E 067°19'40""",24.764444,67.327778,2020-01-24,2005-09-19,,http://www.dpworldkarachi.com/,,
PKKHI,,KICT,KARACHI INTERNATIONAL CONTAINER TERMINAL (KICT),KARACHI INTERNATIONAL CONTAINER TERMINAL,"N 24°50'09""","E 066°58'31""",24.835833,66.975278,,2004-05-31,,https://www.kictl.com/,,
PKKHI,,PICT,PAKISTAN INTERNATIONAL CONTAINER TERMINAL (PICT),PAKISTAN INTERNATIONAL CONTAINER TERMINAL LIMITED,"N 24°49'32""","E 066°58'30""",24.825556,66.975,,2004-05-31,,,,
PKKHI,,SAPT,SOUTH ASIA PAKISTAN TERMINAL (SAPT),SOUTH ASIA PAKISTAN TERMINAL LTD.,"N 24°48'17""","E 066°59'04""",24.804722,66.984444,,2021-03-01,,https://www.sapt.com.pk/,"No. 1 Container Port Road, Keamari South, Karachi 75620, Pakistan",
PLGDN,,PLGDA,GDANSKI TERMINAL KONTENEROWY (GTK),PORT OF GDANSK CARGO LOGISTICS SA,"N 54°22'55""","E 018°39'12""",54.381944,18.653333,2020-02-29,2006-01-16,,https://www.pge.pl/,"Chodackiego 23, 80-555 Gdansk, Poland",Szczecinskie Quay
PLGDY,,PLBCT,BALTIC CONTAINER TERMINAL GDYNIA (BCT),BALTIC CONTAINER TERMINAL GDYNIA (BCT),"N 54°32'40""","E 018°30'41""",54.544444,18.511389,2020-02-29,2006-01-27,,http://www.bct.gdynia.pl/en/,"Eugeniusza Kwiatkowskiego 60, 81-127 Gdynia, Poland",
PLGDY,,PLGCT,GDYNIA CONTAINER TERMINAL (GCT),GDYNIA CONTAINER TERMINAL S.A. / HUTCHISON,"N 54°32'34""","E 018°30'28""",54.542778,18.507778,2020-02-29,2012-06-01,,https://www.gct.pl/en/,"ul. Energetyków 5 81-184 Gdynia, Poland",
PLSZZ,,DPSZ,SZCZECIN CONTAINER TERMINAL,DB PORT SZCZECIN,"N 53°25'42""","E 014°35'08""",53.428333,14.585556,2020-02-29,2006-01-16,,https://portszczecin.deutschebahn.com/dbportszczecin-en/container_terminal,,
PRSJU,,LACS,LUIS AYALA COLON,"LUIS AYALA COLON SUCRS., INC.","N 18°26'06""","W 066°05'35""",18.435,-66.093056,,2016-05-19,,http://www.ayacol.com/,,
PTCNL,,CSP,"CANICAL PORT, MADEIRA","ADMINISTRACAO DOS PORTOS DA REGIAO AUTONOMA DA MADEIRA, SA","N 32°44'12""","W 016°44'00""",32.736667,-16.733333,2020-02-29,2005-10-17,,http://www.apram.pt/site/index.php/en/ports/caracteristicas/port-of-canical,,
PTFDF,,LISC,FIGUEIRA DA FOZ TERMINAL,YIPLORT HOLDING INC.,"N 40°08'49""","W 008°50'51""",40.146944,-8.8475,2020-02-29,2004-05-17,,https://www.yilport.com/en/ports/default/Figueira-Da-Foz-Portugal/112/0/0,,
PTFNC,,APRAM,"FUNCHAL PORT, MADEIRA","ADMINISTRACAO DOS PORTOS DA REGIAO AUTONOMA DA MADEIRA, SA","N 32°38'31""","W 016°54'32""",32.641944,-16.908889,2020-02-29,2004-05-17,,http://www.apram.pt/site/index.php/en/ports/caracteristicas/port-of-funchal,"Gare Marítima do Porto do Funchal, 9004-518 Funchal, Portugal","Not a commercial port, is mainly for cruise ships. But has one RORO pier."
PTLEI,,TCLA,LEIXOES CONTAINER TERMINAL,"TERMINAL DE CONTENTORES DE LEIXOES, SA / YILPORT HOLDING INC.","N 41°11'19""","W 008°41'41""",41.188611,-8.694722,2020-02-29,2009-12-08,,http://www.tcl-leixoes.pt/pt/terminais/,"Rua Mouzinho de Albuquerque 13, 4450-204 Matosinhos, Portugal","North terminal at N41°11'07"" W008°42'04"", south terminal at N41°11'36"" W008°41'06""."
PTLIS,,TMB,BEATO MULTIPURPOSE TERMINAL (TMB),TERMINAL MULTIUSOS DO BEATO (TMB),"N 38°43'53""","W 009°06'15""",38.731389,-9.104167,2020-02-29,2004-05-17,,http://www.tmb.pt/?lang=en,"Rua Cintura do Porto de Lisboa, Armazém 20 - 2º Piso, 1950-015 Lisbon, Portugal",
PTLIS,,OLIS,LISBON MULTIPURPOSE TERMINAL (TML),"OPERLIS, SA","N 38°43'15""","W 009°06'49""",38.720833,-9.113611,2020-02-29,2004-05-17,,https://www.terminal-tsa.pt/,"Terminal Multipurpose de Lisboa, Rua da Cintura do Porto, nº 10, 1900-264 Lisbon, Portugal",
PTLIS,,LISC,LISCONT CONTAINER TERMINAL,YILPORT HOLDING INC.,"N 38°41'57""","W 009°10'07""",38.699167,-9.168611,2020-02-29,2004-05-17,,http://www1.eurogate.de/en/EUROGATE/Terminals/Lisbon,"Terminal de Contentores de Alcantara Sul, 1399-002 Lisbon, Portugal","Also known as ""ALCANTARA CONTAINER TERMINAL (TCA)""."
PTLIS,,SOTA,SANTA APOLONIA CONTAINER TERMINAL (TCSA),"SOTAGUS, SA","N 38°43'33""","W 009°06'25""",38.725833,-9.106944,2020-02-29,2004-05-17,,https://www.yilport.com/en/ports/default/Sotagus-Portugal/113/0/0,,
PTPXO,,APRAM,PORTO SANTO PORT,"ADMINISTRACAO DOS PORTOS DA REGIAO AUTONOMA DA MADEIRA, SA","N 33°03'31""","W 016°18'44""",33.058611,-16.312222,2020-02-29,2004-05-17,,http://www.apram.pt/site/index.php/en/ports/caracteristicas/port-of-porto-santo,,
PTSET,,APSS,MULTI PURPOSE TERMINAL 1 - TERSADO,ADMINISTRACAO DOS PORTOS DE SETUBAL E SESIMBRA,"N 38°31'08""","W 008°52'49""",38.518889,-8.880278,2020-02-29,2004-05-17,,https://www.portodesetubal.pt/Ingles/ingles_port_terminals.htm,,
PTSET,,SADOP,MULTI PURPOSE TERMINAL 2 - SADOPORT,SADOPORT - TERMINAL MARITIMO DO SADO S.A.,"N 38°30'50""","W 008°52'19""",38.513889,-8.871944,2020-02-29,2010-11-23,,https://www.portodesetubal.pt/Ingles/ingles_port_terminals.htm,"Terminal Multiusos Porto Setubal Zona 2, Setubal, 2910-793 Setubal, Portugal",
PTSIE,,SCT,SINES CONTAINER TERMINAL,SINES CONTAINER TERMINAL,"N 37°55'59""","W 008°50'48""",37.933056,-8.846667,2020-02-29,2004-05-17,,https://www.portodesines.pt/en/,"Administracao dos Portos de Sines e do Algarve, SA Apartado 16, EC Sines, 7521-953 Sines, Portugal",
PYASU,PYBCM,CCPMI,PUERTO CAACUPE-MI ASUNCION,SAN FRANCISCO S.A.,"S 25°13'33""","W 057°34'20""",-25.225833,-57.572222,2019-11-18,2017-04-27,,https://www.caa.com.py,"Av. Fernando Leri Reinhold y Hermann Gmeiner, Zeballos Cué Asunción, Paraguay",
PYASU,PYFNX,PFNX,PUERTO FENIX,PUERTO Y ESTIBAJES S.A.,"S 25°13'25""","W 057°34'09""",-25.223611,-57.569167,2020-01-03,2017-04-27,,https://www.puertofenix.com.py,,
PYASU,,PSJ,PUERTO SAN JOSE (EMPEDRIL S.A.),CONCRET-MIX S.A.,"S 25°13'20""","W 057°34'00""",-25.222222,-57.566667,2020-01-03,2017-04-27,,http://www.puertosanjose.com.py,,
PYPIL,,CAP,PUERTO CAACUPE-MI PILAR,CAACUPE-MI,"S 26°52'20""","W 058°19'43""",-26.872222,-58.328611,2020-01-03,2019-11-18,,https://www.caa.com.py/puertos/pilar/,"José de Dalinquist, Bado Ñu, Pilar, Ñeembucu, Paraguay",
PYSAN,PYTER,TERSAN,TERPORT SAN ANTONIO,TERMINALES PORTUARIAS S.A (TERPORT),"S 25°26'40""","W 057°32'57""",-25.444444,-57.549167,2020-01-03,2017-04-27,,http://www.terport.com.py,,
PYVLL,,ANNP,ANNP TERMINAL PORTUARIA VILLETA,ADMINISTRACION NACIONAL DE NAVEGACION Y PUERTOS,"S 25°30'29""","W 057°34'32""",-25.508056,-57.575556,2020-01-03,2019-11-18,,http://www.annp.gov.py,"14 de Mayo, Villeta, Paraguay",
PYVLL,,PSF,PUERTO SEGURO FLUVIAL,PUERTO SEGURO,"S 25°32'52""","W 057°33'55""",-25.547778,-57.565278,2020-01-03,2016-01-12,,https://puertosegurofluvial.com/,"Ruta Villeta, Alberdi Km. 4.5, Villeta, Paraguay",
PYVLL,,TERVIL,TERPORT VILLETA,TERMINALES PORTUARIAS S.A (TERPORT),"S 25°36'42""","W 057°36'32""",-25.611667,-57.608889,2020-01-03,2017-04-27,,http://www.terport.com.py,"Ruta Villeta, Alberdi Km. 13.5, Villeta, Paraguay",
QAHMD,,HCT,HAMAD CONTAINER TERMINAL (HCT),MWANI QATAR,"N 25°02'22""","E 051°36'02""",25.039444,51.600556,,2018-05-25,,https://www.mwani.com.qa/English/Pages/default.aspx,,
QAUMS,,CT7,MESAIEED CONTAINER TERMINAL,QATAR PETROLEUM,"N 24°56'39""","E 051°35'10""",24.944167,51.586111,,2021-03-01,,https://www.mesaieedport.qp.qa,"Mesaieed Port, Container Terminal 7, Berth 7A & 7B","Terminal 7, Berths 7A,7B"
RELPT,,SAMR2,S.A.M.R. (SOCIETE D'ACCONAGE ET DE MANUTENTION DE LA REUNION),CMA CGM / BOLLORE (SAMR / SGM / SOMACOM),"S 20°55'54""","E 055°18'56""",-20.931539,55.31545,2020-09-01,2018-10-15,,https://reunion.port.fr/,,"Berths 10,11"
ROCND,,CSCT,CONSTANTA SOUTH CONTAINER TERMINAL (CSCT),DP WORLD CONSTANTA,"N 44°06'12""","E 028°39'36""",44.103333,28.66,2019-12-17,2015-06-12,,http://www.csct.ro/,,Berth 121
ROCND,,SOCEP,SOCEP CONTAINER TERMINAL,SOCEP S.A. CONTAINER TERMINAL,"N 44°09'05""","E 028°38'44""",44.151389,28.645556,2020-01-24,2015-06-12,,http://www.socep.ro/en/containers-terminal.htm,,"Berth 51,52"
RULED,,CTSP,CONTAINER TERMINAL SAINT-PETERSBURG (CTSP),CONTAINER TERMINAL SAINT-PETERSBURG (CTSP),"N 59°52'22""","E 030°11'56""",59.872778,30.198889,2020-01-03,2014-11-10,,http://www.terminalspb.ru/en/,"22, Elevatornaya ploschadka, Ugolnaya gavan, Saint-Petersburg, Russia, 198096",
RULED,,FCT,FIRST CONTAINER TERMINAL (FCT),FIRST CONTAINER TERMINAL,"N 59°52'52""","E 030°11'59""",59.881111,30.199722,2020-01-03,2003-12-03,,http://www.globalports.com/globalports/about-us/operating-segments/russian-ports,"5, Mezhevoy canal, 3rd district, Saint-Petersburg, Russia, 198035",Berths 82-87
RULED,,MOD,"MOBY DIK TERMINAL, KRONSHTADT",MOBY DIK CO. LTD.,"N 60°00'05""","E 029°42'26""",60.001389,29.707222,2020-01-03,2008-01-16,,http://www.globalports.com/globalports/about-us/operating-segments/russian-ports,"Sea Port Complex, Kronshtadt, Saint-Petersburg, Russia, 197760",
RULED,,BRONKA,MSCC PORT BRONKA,MULTIPURPOSE SEA CARGO COMPLEX (MSCC) BRONKA,"N 59°56'13""","E 029°41'43""",59.936944,29.695278,2020-01-03,2015-12-29,,https://port-bronka.ru/en/,"49, Krasnoflotskoe highway, Lomonosov, Saint-Petersburg, Russia, 198412",
RULED,,NVM,NEVA METAL TERMINAL (NMT),NEVA METAL,"N 59°53'06""","E 030°12'12""",59.885,30.203333,2020-01-03,2015-07-01,,http://nevametal.com/eng,,Berths 71-74
RULED,,PLP,PETROLESPORT TERMINAL,PETROLESPORT,"N 59°53'28""","E 030°13'32""",59.891111,30.225556,2020-01-03,2004-10-12,,http://www.globalports.com/globalports/about-us/operating-segments/russian-ports,"1, Gladky Island, Saint-Petersburg, Russia, 198095","Berths 42,43,46-48,56-58,60-64"
RULED,,SFP,SEA FISHING PORT TERMINAL,SEA FISHING PORT,"N 59°52'09""","E 030°12'46""",59.869167,30.212778,2020-01-03,2014-11-10,,http://www.seafishport.ru/,"Elevator area, building 10, St. Petersburg, Russia, 198096",Berths R1-R6
RUNVS,,NUTEP,NUTEP CONTAINER TERMINAL,DELOPORTS,"N 44°43'18""","E 037°48'58""",44.721667,37.816111,2020-02-29,2020-02-29,,http://www.nutep.ru/en/,"Sukhumskoe shosse 17A, Novorossiysk, Russia, 353902",
RUULU,,ULCT,UST-LUGA CONTAINER TERMINAL (ULCT),GLOBAL PORTS,"N 59°40'27""","E 028°24'21""",59.674167,28.405833,2020-01-03,2014-11-10,,http://www.globalports.com/globalports/about-us/operating-segments/russian-ports,,
RUVVO,,PLCT,PACIFIC LOGISTIC CONTAINER TERMINAL,PACIFIC LOGISTIC LLC,"N 43°06'20""","E 131°55'58""",43.105556,131.932778,,2020-06-08,,http://www.pacific-logistic.ru/en,"Dalzavodskaya Ulitsa, 2, korpus 14, Vladivostok, Primorsky Krai, Russia, 690001",Terminal commonly referred to as SOLLERS TERMINAL.
RUVVO,,VCT,VLADIVOSTOK CONTAINER TERMINAL (VCT),COMMERCIAL PORT OF VLADIVOSTOK PJSC,"N 43°05'25""","E 131°52'05""",43.090278,131.868056,,2020-06-08,,https://vmtp.ru/en/,"Strelnikova Ulitsa, 9, Vladivostok, Primorsky Krai, Russia, 690065","Berths 14,15,16. Company name in Russian: Vladivostokskiy Morskoy Torgovyy Port (VMTP)."
RUVVO,,VSCT,VLADIVOSTOK SEA CONTAINER TERMINAL (VSCT),VLADIVOSTOK SEA CONTAINER TERMINAL LLC,"N 43°05'36""","E 131°52'52""",43.093333,131.881111,,2021-03-01,,https://www.vsct.info/,"Berezovaya Ulitsa, 25, Vladivostok, Primorsky Krai, Russia, 690012","Berths 50,51,52,53. Terminal commonly referred to as VLADIVOSTOK SEA FISHING PORT."
RUVYP,,VSC,VOSTOCHNAYA STEVEDORING COMPANY (VSC),GLOBAL PORTS,"N 42°44'06""","E 133°04'46""",42.735,133.079444,,2020-06-08,,http://www.vscport.ru/en-us/,"Nakhodka, Primorsky Krai, Russia, 692943",
SADMM,,FCT,DAMMAM FIRST CONTAINER TERMINAL (FCT),SAUDI GLOBAL PORTS CO. (SGPC),"N 26°30'18""","E 050°11'49""",26.505,50.196944,,2020-12-01,,https://saudiglobalports.com.sa/,"Port Gate Complex, Office No.9-2nd floor, Port Road, Al Khadlidiah, Dammam, Kingdom of Saudi Arabia",King Abdul Aziz port in Dammam.
SADMM,,SCT,DAMMAM SECOND CONTAINER TERMINAL (SCT),SAUDI GLOBAL PORTS CO. (SGPC),"N 26°30'24""","E 050°11'30""",26.506667,50.191667,,2020-12-01,,https://saudiglobalports.com.sa/,"Port Gate Complex, Office No.9-2nd floor, Port Road, Al Khadlidiah, Dammam, Kingdom of Saudi Arabia",King Abdul Aziz port in Dammam.
SAJED,,DPW,DP WORLD SOUTH CONTAINER TERMINAL JEDDAH (SCT),DP WORLD JEDDAH,"N 21°27'17""","E 039°09'30""",21.454722,39.158333,2020-02-29,2015-03-25,,https://www.dpworld.com/what-we-do/our-locations/Middle-East-Africa/Saudi-Arabia/arabia-jeddah,,
SAJED,,GCT,NORTHERN CONTAINER TERMINAL JEDDAH,GULFTAINER SAUDI ARABIA,"N 21°28'45""","E 039°09'28""",21.479167,39.157778,2020-02-29,2015-03-25,,,,
SAJED,,RSGT,RED SEA GATEWAY TERMINAL,RED SEA GATEWAY TERMINAL,"N 21°29'04""","E 039°09'17""",21.484444,39.154722,2020-02-29,2015-03-25,,http://rsgt.com/,,
SAJUB,,GSC,JUBAIL COMMERCIAL PORT,GULFTAINER SAUDI ARABIA,"N 27°01'39""","E 049°40'58""",27.0275,49.682778,2020-02-29,2015-09-21,,,,
SAKAC,,KACT,KING ABDULLAH NATIONAL CONTAINER TERMINAL (NCT),KING ABDULLAH PORT,"N 22°31'34""","E 039°05'33""",22.526111,39.0925,2020-02-29,2017-01-17,,https://www.kingabdullahport.com.sa/,,
SDPZU,,SPC,SOUTH PORT CONTAINER TERMINAL,SEA PORT CORPORATION,"N 19°36'13""","E 037°13'55""",19.603611,37.231944,,2019-01-17,,http://sudanports.gov.sd/web/en/,,
SEAHU,,AHU,AHUS CONTAINER TERMINAL,AHUS HAMN STUVERI AB,"N 55°55'41""","E 014°19'28""",55.928056,14.324444,2020-02-29,2015-02-10,,https://www.ahushamn.se/en/index_en/,,
SEGOT,,CT1,APM TERMINALS GOTHENBURG,APM TERMINALS GOTHENBURG,"N 57°41'19""","E 011°51'22""",57.688611,11.856111,2020-02-29,2018-10-25,,https://www.apmterminals.com/gothenburg,,
SEGOT,,CAR,CAR TERMINAL GOTHENBURG,LOGENT PORTS & TERMINALS AB,"N 57°41'29""","E 011°52'02""",57.691389,11.867222,2020-05-01,2004-12-14,,https://logent.se/index.php/ports-terminals/,"Port 2, Sydatlanten 30, 418 34 Göteborg, Sweden",
SEGOT,,RTG,RORO TERMINAL GOTHENBURG,DFDS A/S,"N 57°41'26""","E 011°50'09""",57.690556,11.835833,2020-05-01,2004-12-14,,https://www.dfds.com/en/freight-shipping/terminal-services/gothenburg-terminal,"Ytterhamnsvägen 1, 418 34 Göteborg, Sweden",
