UNLOCODE,Alternative UNLOCODEs,Terminal Code,Terminal Facility Name,Terminal Company Name,Latitude (DMS),Longitude (DMS),Latitude,Longitude,Last change,Valid from,Valid until,Terminal Website,Terminal Address,Remarks
ESCAD,,TCD,"CONCASA CONTAINER TERMINAL, REINA SOFIA QUAY","COMPANIA GADITANA DE CONTENEDORES, SL (CONCASA)","N 36°32'16""","W 006°17'14""",36.537778,-6.287222,2020-02-29,2005-07-21,,https://www.puertocadiz.com/en/home/,,
ESCAR,,TMC,TERMINAL MARITIMA DE CARTAGENA (TMC),NOATUM MARITIME,"N 37°35'39""","W 000°58'26""",37.594167,-0.973889,2020-02-29,2005-08-18,,https://www.noatum.com/en/terminales-operaciones-portuarias/terminales-maritimos-de-cartagena/,,
ESCEU,,CETRU,DIQUE DE PONIENTE CEUTA,DIQUE DE PONIENTE CEUTA,"N 35°53'52""","W 005°19'26""",35.897778,-5.323889,2020-02-29,2005-08-18,,http://www.puertodeceuta.com/en/home/,,
ESGIJ,,TEGIJ,TERMINAL GIJON,TERMINAL DE CONTENEDORES DE GIJON A.I.E.,"N 43°33'18""","W 005°41'22""",43.555,-5.689444,,2004-05-31,,https://www.apmterminals.com/gijon,"Muelle de La Osa, Tinglado 1, Puerto de El Musel, 33212 Gijón, Spain",
ESHUV,,PDH,HUELVA CONTAINER TERMINAL,YILPORT HOLDING INC.,"N 37°09'05""","W 006°52'48""",37.151389,-6.88,,2020-09-01,,https://www.yilport.com/en/ports/default/Huelva-Spain/117/0/0,"Puerto Exterior, Muelle Sur, 21810 Puerto de Huelva, Spain",
ESLCG,,TMGA,TERMINALES MARITIMOS DE GALICIA (TMGA),TERMINALES MARITIMOS DE GALICIA (TMGA),"N 43°21'33""","W 008°23'34""",43.359167,-8.392778,2020-02-29,2015-11-01,,http://www.tmga.es/La_Coruna_Terminal,"Muelle de San Diego, s/n, 15006 A Coruna, Spain",
ESLPA,,LALUZ,BOLUDA MARITIME TERMINAL LA LUZ,BOLUDA CORPORACION MARITIMA S.A.,"N 28°08'33""","W 015°24'43""",28.1425,-15.411944,,2004-05-31,,https://www.boluda.com.es/en/maritime-terminals/las-palmas-de-gran-canaria-en/,,
ESLPA,,OPCSA,"OPERACIONES PORTUARIAS, S.A.","OPERACIONES PORTUARIAS, S.A.","N 28°07'59""","W 015°24'53""",28.133056,-15.414722,2020-01-03,2017-01-29,,http://www.opcsa.com/opcsacom/,"Muelle de León y Castillo, 12, 35008 Las Palmas de Gran Canaria, Las Palmas, Spain",
ESMLN,,EPN,MELILLA PORT,MELILLA PORT,"N 35°17'28""","W 002°55'37""",35.291111,-2.926944,2020-02-29,2005-10-07,,https://www.puertodemelilla.es/,,
ESMPG,,MPT,MARIN PORT TERMINAL,PEREZ TORRES MARITIMA S.L.,"N 42°24'19""","W 008°41'34""",42.405278,-8.692778,2020-02-29,2015-11-01,,https://www.ptmar.com/en/puertos/puerto-marin,,
ESSAG,,INTERS,"INTERSAGUNTO TERMINALES, S.A.","INTERSAGUNTO TERMINALES, S.A.","N 39°38'40""","W 000°13'00""",39.644444,-0.216667,2020-01-03,2017-01-29,,http://saguntoti.com/,"Muelle Norte 2 S/N, 46520 Puerto de Sagunto, Valencia, Spain",
ESSCT,,CAPSA,BOLUDA MARITIME TERMINAL TENERIFE,BOLUDA CORPORACION MARITIMA S.A.,"N 28°29'15""","W 016°13'43""",28.4875,-16.228611,2020-02-29,2005-08-22,,https://www.boluda.com.es/en/maritime-terminals/tenerife-en/,"Carretera San Andrés, Muelle del Bufadero, 1, 38180 Santa Cruz de Tenerife, Spain",Boluda Corporacion Maritima acquired Compania Auxiliar del Puerto (CAPSA) in October 2017.
ESSCT,,ESTCT,CONTAINER TERMINAL TENERIFE (TCT),TERMINAL DE CONTENEDORES DE TENERIFE SA,"N 28°29'21""","W 016°13'25""",28.489167,-16.223611,2020-02-29,2013-04-11,,http://www.tctenerife.es/en/,"Nueva Terminal del Dique del Este, 38180 Santa Cruz de Teneriffe, Spain",
ESTAR,,DPWTA,DP WORLD TARRAGONA,"DP WORLD TARRAGONA, S.A.","N 41°05'43""","E 001°12'37""",41.095278,1.210278,,2004-05-31,,https://www.dpworldtarragona.com/,"Muelle de Andalucia, s/n, 43004 Tarragona, Spain",
ESTAR,,FRUPO,FRUPORT TARRAGONA,FRUPORT TARRAGONA S.L.,"N 41°06'21""","E 001°14'23""",41.105833,1.239722,2021-03-01,2004-05-31,,http://www.fruport.com/,"Muelle de Reus, s/n, 43004 Tarragona, Spain",
ESVGO,,TMI,TERMINALES MARITIMAS DE VIGO (TERMAVI),TERMINALES MARITIMAS DE VIGO S.L. (TERMAVI),"N 42°14'46""","W 008°42'37""",42.246111,-8.710278,2020-02-29,2005-10-07,,https://www.termavi.com/,"Terminales maritimas de Vigo S.L.U, Muelle de Guixar, s/n, 36280 Vigo, Spain",
ESVLC,,TCV,APM TERMINALS VALENCIA (TCV),APM TERMINALS,"N 39°27'08""","W 000°19'07""",39.452222,-0.318611,2020-02-29,2004-05-17,,https://www.apmterminals.com/valencia,,"Established as ""TCV Multipurpose Terminal"" at the Levante Pier. APMT acquired 75% in 2016."
ESVLC,,NOATV,CSP SPAIN VALENCIA TERMINAL,COSCO SHIPPING PORTS (SPAIN) TERMINALS S.L.U.,"N 39°25'57""","W 000°19'26""",39.4325,-0.323889,2020-02-29,2004-05-31,,https://cspspain.com/en/valencia,,Noatum Ports rebranded itself to CSP Spain in April 2019.
ESVLC,,MSCVC,MSC TERMINAL VALENCIA,MEDITERRANEAN SHIPPING COMPANY TERMINAL VALENCIA S.A.,"N 39°26'20""","W 000°19'25""",39.438889,-0.323611,2020-02-29,2004-05-31,,https://www.msctv.es/,,
FIHEL,,MLTHEL,MULTI-LINK TERMINAL VUOSAARI,MULTI-LINK TERMINALS LTD. OY,"N 60°12'44""","E 025°11'31""",60.212222,25.191944,2020-02-29,2015-03-17,,http://mlt.fi/vuosaari/,,"Vuosaari Harbour, D (West) Quay (southern part), berths VDC/VD5"
FIHEL,,FSHVU,"VUOSAARI HARBOUR, EAST QUAY",FINNSTEVE OY AB,"N 60°12'55""","E 025°11'35""",60.215278,25.193056,2020-02-29,2006-03-13,,http://www.finnsteve.com/location/helsinki,,"Vuosaari Harbour, E (East) Quay, berths VEA/VEB/VEC/VED"
FIHEL,,FIVCT,"VUOSAARI HARBOUR, WEST QUAY",STEVECO OY,"N 60°12'53""","E 025°11'16""",60.214722,25.187778,2020-02-29,2008-10-27,,https://www.steveco.fi/en/index/toimipisteet/YKcus5Nvg.html,"Satamakaari 35C, 00980 Helsinki, Finland","Vuosaari Harbour, D (West) Quay (northern part), berths VDA/VDB"
FIHMN,,FIHMN,PORT OF HAMINA,STEVECO OY,"N 60°31'35""","E 027°10'12""",60.526389,27.17,2020-02-29,2006-02-27,,https://www.steveco.fi/en/index/toimipisteet/2YbuynxZs.html,"Gerhardin väylä 4, 49460 Hamina, Finland",
FIKOK,,AWT,ALL WEATHER TERMINAL KOKKOLA,OY M RAUANHEIMO AB,"N 63°50'40""","E 023°01'11""",63.844444,23.019722,2020-01-03,2019-09-13,,https://www.rauanheimo.com/en/kokkola-2/,"Satamatullintie 5, 67900 Kokkola, Finland",
FIKOK,,STE,SILVERSTONE PORT,PORT OF KOKKOLA LTD.,"N 63°51'35""","E 023°02'10""",63.859722,23.036111,2020-01-03,2019-09-13,,https://portofkokkola.fi/en/ports/silverstone-port/,"Kantasatamantie 50, 67900 Kokkola, Finland",
FIKTK,,FIKCT,KOTKA CONTAINER TERMINAL,STEVECO OY,"N 60°25'16""","E 026°54'33""",60.421111,26.909167,2020-04-01,2006-02-27,,https://www.steveco.fi/en/index/toimipisteet/tphMBmr6K.html,"Siikasaarentie 130, 48310 Kotka, Finland","Mussalo Harbour, C Quay"
FIKTK,,MLTKTK,MULTI-LINK TERMINAL KOTKA,MULTI-LINK TERMINALS LTD. OY,"N 60°25'27""","E 026°54'35""",60.424167,26.909722,2020-04-01,2015-03-17,,http://mlt.fi/,"Merituulentie 424, 48310 Kotka, Finland","Mussalo Harbour, B Quay"
FIKTK,,FIHIE,RORO TERMINAL HIETANEN,STEVECO OY,"N 60°29'08""","E 026°56'46""",60.485556,26.946111,2020-02-29,2006-02-27,,https://www.steveco.fi/en/index/toimipisteet/yIhKeO3ym.html,"Hietasentie 123, 48200 Kotka, Finland",RoRo terminal
FIMTY,,FHCL,MANTYLUOTO (PORT OF PORI),OY HACKLIN LTD.,"N 61°35'49""","E 021°28'12""",61.596944,21.47,2020-02-29,2009-02-20,,https://www.hacklin.fi/page.php?lang=en&id=32,,
FIRAU,,REU,RAUMA PORT,RAUMA PORT,"N 61°07'50""","E 021°25'58""",61.130556,21.432778,2020-02-29,2015-10-09,,https://www.portofrauma.com/en,,
FITKU,,FSTP,PANSIO HARBOUR,FINNSTEVE OY AB,"N 60°26'33""","E 022°10'05""",60.4425,22.168056,2020-02-29,2006-03-13,,https://www.portofturku.fi/en/ports-operations/areas-and-maps/pansio-harbour/,,
FITKU,,FSTW,WEST HARBOUR,FINNSTEVE OY AB,"N 60°26'17""","E 022°12'45""",60.438056,22.2125,2020-02-29,2006-03-13,,https://www.portofturku.fi/en/ports-operations/areas-and-maps/west-harbour/,,
FJSUV,,POSU,PORT OF SUVA,FIJI PORT CORPORATION LIMITED,"S 18°07'57""","E 178°25'30""",-18.1325,178.425,,2014-02-06,,,,
FRDKK,,TDF,TERMINAL DES FLANDRES,TERMINAL DES FLANDRES,"N 51°00'52""","E 002°11'01""",51.014444,2.183611,,2017-09-15,,https://www.terminal-des-flandres.com/en/,"Port Ouest, 5895 Route du Royaume Uni, 59279 Loon-Plage, France",
FRFOS,,EURFO,EUROFOS,EUROFOS,"N 43°24'24""","E 004°51'01""",43.406667,4.850278,,2004-05-31,,https://www.eurofos.fr/,,
FRFOS,,SEYA,SEAYARD,SEAYARD,"N 43°25'11""","E 004°49'48""",43.419722,4.83,,2004-05-31,,http://www.seayard.com/fr/,,
FRLEH,,TDF,"TERMINAL DE FRANCE, QUAI DU HAVRE",GENERALE DU MANUTENTION PORTUAIRE (GMP),"N 49°27'27""","E 000°10'12""",49.4575,0.17,2020-01-24,2006-06-08,,https://www.haropaports.com/en/container-terminals,,
FRLEH,,QATL,"TERMINAL DE L'ATLANTIQUE, QUAI DE L'ATLANTIQUE",COMPAGNIE NOUVELLE DE MANUTENTIONS PORTUAIRES (CNMP),"N 49°28'25""","E 000°09'13""",49.473611,0.153611,2020-01-24,2004-05-31,,https://www.haropaports.com/en/container-terminals,"3744 Quai de l'Atlantique, CS 80880, 76087 Le Havre, France",
FRLEH,,TMS,TERMINAL DE NORMANDIE MSC (TNMSC),TERMINAUX DE NORMANDIE,"N 49°27'41""","E 000°08'29""",49.461389,0.141389,2020-01-24,2012-04-02,,https://www.haropaports.com/en/container-terminals,,
FRLEH,,EUP,"TERMINAL NORD, QUAI DE L'EUROPE",GENERALE DU MANUTENTION PORTUAIRE (GMP),"N 49°28'53""","E 000°10'41""",49.481389,0.178056,2020-01-24,2005-10-07,,https://www.haropaports.com/en/container-terminals,"Avenue du 16éme Port, 76600 Le Havre, France",
FRLEH,,AMQ,"TERMINAL NORD, QUAI DES AMERIQUES",GENERALE DU MANUTENTION PORTUAIRE (GMP),"N 49°28'34""","E 000°09'55""",49.476111,0.165278,2020-01-24,2005-10-07,,https://www.haropaports.com/en/container-terminals,"Avenue du 16éme Port, 76600 Le Havre, France",
FRLEH,,TPO,TERMINAL PORTE OCEANE,TERMINAUX DE NORMANDIE,"N 49°27'35""","E 000°09'14""",49.459722,0.153889,2020-04-01,2006-10-27,,https://www.haropaports.com/en/container-terminals,"Zone Port 2000, Route de lEstuaire Port Sud, 76600 Le Havre, France",
FRMTX,,TGO,"TERMINAL DU GRAND OUEST, QUAI DE MONTOIR",TERMINAL DU GRAND OUEST (TGO),"N 47°18'00""","W 002°09'00""",47.3,-2.15,,2017-11-23,,https://www.tgo-terminal.com,,
GAOWE,,NGI,NEW GABON INTERNATIONAL PORT OWENDO,GSEZ CARGO PORT S.A,"N 00°17'03""","E 009°30'24""",0.284167,9.506667,,2017-04-03,,http://www.gsez.com/new-owendo-international-port.php,,
GBBEL,,VIC3,VICTORIA TERMINAL 3 (VT3),BELFAST CONTAINER TERMINAL,"N 54°37'56""","W 005°53'05""",54.632222,-5.884722,2020-01-03,2015-05-22,,https://www.icg.ie/our-businesses/container-terminal/belfast-container-terminals/,"19 W Bank Rd, Belfast BT3 9JL, United Kingdom",
GBFXT,,DLY,DOOLEY RORO TERMINAL,PORT OF FELIXSTOWE,"N 51°57'07""","E 001°18'51""",51.951944,1.314167,2020-01-03,2004-05-31,,https://www.portoffelixstowe.co.uk/port/ro-ro-operations/,"Tomline House, The Dock, Felixstowe IP11 3SY, United Kingdom",
GBFXT,,LNG,LANDGUARD TERMINAL,PORT OF FELIXSTOWE,"N 51°56'33""","E 001°19'12""",51.9425,1.32,2020-01-03,2004-05-31,,https://www.portoffelixstowe.co.uk/,"Tomline House, The Dock, Felixstowe IP11 3SY, United Kingdom",
GBFXT,,TTY,TRINITY TERMINAL,PORT OF FELIXSTOWE,"N 51°57'38""","E 001°17'48""",51.960556,1.296667,2020-01-03,2004-05-31,,https://www.portoffelixstowe.co.uk/port/container-operations-berths-1-7/,"Tomline House, The Dock, Felixstowe IP11 3SY, United Kingdom",
GBGRG,,GBGR,GRANGEMOUTH TERMINAL,GRANGEMOUTH TERMINAL,"N 56°01'27""","W 003°41'57""",56.024167,-3.699167,2020-01-03,2004-05-31,,https://www.forthports.co.uk/our-ports/grangemouth/,,
GBGRK,,CLYDE,CLYDEPORT CONTAINER TERMINAL,PEEL PORTS CLYDEPORT CONTAINER TERMINAL,"N 55°57'21""","W 004°45'43""",55.955833,-4.761944,2020-01-03,2017-03-09,,https://www.peelports.com/ports/clydeport,,
GBHUL,,HCT,QUEEN ELIZABETH DOCK,HULL CONTAINER TERMINAL,"N 53°44'20""","W 000°15'47""",53.738889,-0.263056,2020-01-03,2006-07-10,,,,
GBLGP,,DPWLG,LONDON GATEWAY,DP WORLD,"N 51°30'26""","E 000°29'00""",51.507222,0.483333,,2014-02-06,,,,
GBLIV,,RSCT,ROYAL SEAFORTH CONTAINER TERMINAL (RSCT),MERSEY DOCKS & HARBOUR COMPANY LTD.,"N 53°27'41""","W 003°01'18""",53.461389,-3.021667,2020-02-29,2015-05-22,,https://www.peelports.com/ports/liverpool,"Royal Seaforth Container Terminal, Liverpool L21 1JD, United Kingdom",Berths 3-6
GBRCS,,LTP,LONDON THAMESPORT CONTAINER TERMINAL,HUTCHISON PORT HOLDINGS (HPH),"N 51°25'58""","E 000°41'11""",51.432778,0.686389,,2004-05-31,,http://www.londonthamesport.co.uk/,"Grain Rd, Rochester ME3 0EP, United Kingdom",
GBSOU,,DPWS,DP WORLD SOUTHAMPTON,DP WORLD,"N 50°54'26""","W 001°27'26""",50.907222,-1.457222,2020-01-03,2015-05-22,,,,
GBTEE,,TEES,TEESPORT CONTAINER TERMINAL,PD PORTS TEESPORT CONTAINER TERMINAL,"N 54°36'20""","W 001°09'29""",54.605556,-1.158056,2020-05-01,2017-03-09,,https://www.pdports.co.uk/locations/teesport/,,"Two terminals: TCT1 at N54°36'06""N W001°09'06"" and TCT2 at N54°36'28""N W001°09'18""."
GBTIL,,LCT,LONDON CONTAINER TERMINAL,LONDON CONTAINER TERMINAL LTD.,"N 51°27'35""","E 000°20'13""",51.459722,0.336944,2020-01-03,2015-09-21,,https://www.londoncontainerterminal.com/,,
GEPTI,,APMT,APM TERMINALS POTI,APM TERMINALS POTI SEA PORT,"N 42°09'08""","E 041°39'12""",42.152222,41.653333,,2020-01-24,,https://www.apmterminals.com/en/poti,"52 David Aghmashenebeli Street, Poti 4401, Georgia","The inner pier at N42°09'16"" E041°39'53"" is also used by APMT."
GHTEM,,MPS,MERIDIAN PORT SERVICES,"MERIDIAN PORT SERVICES LTD (BOLLORE, APMT)","N 05°37'31""","E 000°00'31""",5.625278,0.008611,,2015-09-22,,http://www.mps-gh.com,,
GHTEM,,MPS3,MERIDIAN PORT SERVICES (MPS) TERMINAL 3,MERIDIAN PORT SERVICES LTD,"N 05°36'47""","W 000°00'47""",5.613056,-0.013056,2020-05-01,2019-07-05,,http://www.mps-gh.com,"Meridian Port Services Limited; P.O.BOX TT240, Tema New Town  Ghana;Tel: +233 (0) 307 085 000",
GHTEM,,GPHA,TEMA MAIN HARBOUR,TEMA MAIN HARBOUR,"N 05°37'49""","E 000°00'32""",5.630278,0.008889,,2015-09-22,,,,
GHTKD,,TKD1,TAKORADI PORT,GHANA PORTS AND HARBOURS AUTHORITY (TEMA PORT),"N 04°53'09""","W 001°44'17""",4.885972,-1.738028,,2020-05-01,,http://www.ghanaports.gov.gh,"Ghana Ports and Harbours Authority, P.O. Box CO488, Tema, Ghana; +233 (0) 303 219 120",
GIGIB,,GIBNM,"GIBRALTAR NORTH MOLE, BERTH 6","M.H. BLANDS STEVEDORING CO., LTD.","N 36°08'52""","W 005°21'50""",36.147778,-5.363889,2020-01-24,2004-05-31,,https://www.gibraltarport.com/,,
GRPIR,,GRPCT,PIRAEUS CONTAINER TERMINAL,PIRAEUS CONTAINER TERMINAL SA,"N 37°57'36""","E 023°35'09""",37.96,23.585833,,2015-03-11,,http://www.pct.com.gr,,
GRPIR,,PPA,PIRAEUS PORT AUTHORITY SA,PIRAEUS PORT AUTHORITY SA,"N 37°57'17""","E 023°35'22""",37.954722,23.589444,,2004-05-31,,,,
GRSKG,,THPASA,PORT AUTHORITY THESSALONIKI,PORT AUTHORITY THESSALONIKI,"N 40°38'08""","E 022°54'22""",40.635556,22.906111,2020-02-29,2015-09-21,,https://www.thpa.gr/,,
GTPBR,,TFPB,TERMINAL FERROVIARIA PUERTO BARRIOS,TERMINAL FERROVIARIA PUERTO BARRIOS,"N 15°44'04""","W 088°36'21""",15.734444,-88.605833,,2015-02-11,,,,
GTPRQ,,EPQEZ,EMPRESA PORTUARIA QUETZAL,EMPRESA PORTUARIA QUETZAL,"N 13°55'32""","W 090°47'10""",13.925556,-90.786111,,2004-05-31,,http://www.puerto-quetzal.com/,,
GTPRQ,,TCQ,TERMINAL DE CONTENEDORES QUETZAL (TCQ),APM TERMINALS,"N 13°55'38""","W 090°47'28""",13.927222,-90.791111,2020-02-29,2017-05-23,,https://www.apmterminals.com/en/puerto-quetzal,,APMT acquired TCS in 2015.
GTSTC,,EPSTC,EMPRESA PORTUARIA NACIONAL TERMINAL,EMPRESA PORTURIA NACIONAL,"N 15°41'47""","W 088°36'58""",15.696389,-88.616111,,2004-05-31,,,,
HKHKG,,ACTHK,ASIA CONTAINER TERMINALS (ACT),ASIA CONTAINER TERMINALS LTD.,"N 22°19'29""","E 114°07'35""",22.324722,114.126389,2020-01-03,2010-10-22,,https://www.hphtrust.com/portfolio_act.html,"Terminal 8 West, Container Port Road South, Kwai Chung, Hong Kong",Kwai Tsing Terminal 8 West
HKHKG,,CMC,CHINA MERCHANTS CONTAINER SERVICES,CHINA MERCHANTS CONTAINER SERVICES LTD.,"N 22°19'51""","E 114°05'22""",22.330833,114.089444,,2015-06-24,,http://cmcs.com.hk,"5-9 Tsing Keung Street, Tsing Yi, New Territories, Hong Kong",Euroasia dockyard.
HKHKG,,CHTHK,COSCO-HIT (CHT),COSCO-HIT TERMINALS (HONG KONG) LTD.,"N 22°19'35""","E 114°07'56""",22.326389,114.132222,2020-01-03,2010-10-22,,https://www.hphtrust.com/portfolio_cosco.html,"Terminal 8 East, Container Port Road South, Kwai Chung, Hong Kong",Kwai Tsing Terminal 8 East
HKHKG,,DPWHK,DP WORLD HONG KONG - CT3,DP WORLD ASIA,"N 22°20'32""","E 114°07'21""",22.342222,114.1225,2020-01-03,2010-10-22,,https://www.dpworld.com/what-we-do/our-locations/Asia-Pacific/China/hong-kong-ct3,,Kwai Tsing Terminal 3
HKHKG,,HITHK,HONG KONG INTERNATIONAL TERMINALS (HIT),HONGKONG INTERNATIONAL TERMINALS LIMITED,"N 22°19'56""","E 114°07'33""",22.332222,114.125833,2020-01-03,2010-10-22,,https://www.hphtrust.com/portfolio_hit.html,"Terminal 4, Container Port Road South, Kwai Chung, Hong Kong","Kwai Tsing Terminals 4, 6, 7 and 9 North"
HKHKG,,MTLHK,HONG KONG MODERN TERMINALS (MTL),MODERN TERMINALS LIMITED,"N 22°20'52""","E 114°07'14""",22.347778,114.120556,2020-01-03,2010-10-22,,http://www.modernterminals.com/group/index.php/Index/index.html,,"Kwai Tsing Terminals 1, 2, 5 and 9 South"
HKHKG,,WFC,WEALTH FAIR CONTAINER SERVICES,WEALTH FAIR CONTAINER SERVICES LTD.,"N 22°21'48""","E 113°56'08""",22.363333,113.935556,,2015-06-24,,http://www.rttc.com.hk/rtt/eng/home_1024_skip.html,"201 Lung Mun Road, Tuen Mun, New Territories, Hong Kong","River Trade Terminal, Berth 46, Zone 4"
HNPCR,,ENPCR,EMPRESA NACIONAL PORTUARIA,AGENCIA NAVIERA EUROPEA S.A. - ANAVE,"N 15°50'35""","W 087°56'45""",15.843056,-87.945833,,2004-05-31,,,,
HNSLO,,ENPSL,EMPRESA NACIONAL PORTUARIA,PORT OF SAN LORENZO,"N 13°24'08""","W 087°25'30""",13.402222,-87.425,,2016-07-28,,,,
HRRJK,,AGCT,ADRIATIC GATE CONTAINER TERMINAL (AGCT),LUKA RIJEKA / INTERNATIONAL CONTAINER TERMINAL SERVICES INC. (ICTSI),"N 45°19'12""","E 014°27'15""",45.32,14.454167,2020-01-03,2019-10-04,,,,
HTLFF,,LFU,PORT LAFITO,PORT LAFITO S.A.,"N 18°41'38""","W 072°21'54""",18.693889,-72.365,,2021-03-01,,https://portlafito.com/,"Route Nationale No. 1, Chancerelles, Port-au-Prince, Haiti",
HTPAP,,TVB,TERMINAL VARREUX BOLLORE PORT-AU-PRINCE (TVB),BOLLORE PORTS,"N 18°34'23""","W 072°20'54""",18.573056,-72.348333,,2020-10-01,,https://www.bollore-ports.com/en/worldwide-network/americas/port-of-port-au-prince-haiti.html,"1, Route du Terminal Varreux, Chancerelles, Port-au-Prince, Haiti",
IDBDJ,,PERUMP,TRISAKTI PORT BANJARMASIN,PELINDO III,"S 03°19'39""","E 114°33'30""",-3.3275,114.558333,,2018-08-06,,https://www.pelindo.co.id/id/port-terminal/pelabuhan-banjarmasin,"Jl. Barito Hilir Trisakti No. 6, Banjarmasin 70119, Indonesia",
IDBTM,IDBUR,AMPAR,PORT OF BATU AMPAR,PELINDO I,"N 01°09'59""","E 104°00'08""",1.166389,104.002222,2020-02-29,2015-03-10,,https://www.pelindo1.co.id/cabang/BTM/en/berita/pages/Pelabuhan-Batam.aspx,,
IDJKT,,KADE,CONVENTIONAL TANJUNG PRIOK PORT,CONVENTIONAL TPK,"S 06°06'06""","E 106°53'00""",-6.101667,106.883333,2020-08-01,2015-06-12,,,,Multiple operators at multiple berths.
IDJKT,,UTC1,JAKARTA INTERNATIONAL CONTAINER TERMINAL (UTC1),PELINDO II / HUTCHISON PORTS,"S 06°05'52""","E 106°53'35""",-6.097778,106.893056,2020-08-01,2015-06-12,,https://www.jict.co.id/,"Jl. Sulawesi Ujung No. 1, Tanjung Priok, Jakarta 14310, Indonesia",
IDJKT,,UTC3,KOJA CONTAINER TERMINAL (UTC3),PELINDO II / HUTCHISON PORTS,"S 06°06'07""","E 106°54'15""",-6.101944,106.904167,2020-08-01,2015-06-12,,http://www.tpkkoja.co.id,"Digul No.1, RW.1, Koja, Kec. Koja, Kota Jkt Utara, Jakarta 14220, Indonesia",
IDJKT,,T300,TERMINAL MUSTIKA ALAM LESTARI (MAL),PT MUSTIKA ALAM LESTARI,"S 06°05'51""","E 106°53'22""",-6.0975,106.889444,2020-02-29,2015-06-12,,https://dlca.logcluster.org/display/public/DLCA/2.1.1+Indonesia+Jakarta+Port+of+Tanjung+Priok,"Jl. Bitung Ujung No.1, RW.1, Tj. Priok, Kota Jkt Utara, Jakarta 14310, Indonesia",Berth 300
IDPLM,,BOOMBA,TERMINAL PETIKEMAS PALEMBANG BOOM BARU,PELINDO II,"S 02°58'50""","E 104°46'43""",-2.980556,104.778611,,2018-08-06,,http://www.palembangport.co.id/,"Jalan Belinyu No.1, Boom Baru, Palembang 30115, Indonesia",
IDSUB,,BJTI,BERLIAN JASA TERMINAL INDONESIA (BJTI),PT BERLIAN JASA TERMINAL INDONESIA (BJTI),"S 07°12'20""","E 112°43'34""",-7.205556,112.726111,2020-02-29,2015-05-03,,https://www.bjtiport.co.id/b/index.php?option=com_content&view=article&id=237&Itemid=26,"Jl. Prapat Kurung Utara No.60, Perak Utara, Kec. Pabean Cantian, Surabaya 60165, Indonesia",
IDSUB,,TPS,TERMINAL PETIKEMAS SURABAYA (TPS),PT TERMINAL PETIKEMAS SURABAYA (TPS),"S 07°11'52""","E 112°42'37""",-7.197778,112.710278,2020-02-29,2005-09-19,,https://www.tps.co.id/,"Jl. Tanjung Mutiara 1, Surabaya 60177, Indonesia",
IEDUB,,DFP,DUBLIN FERRYPORT TERMINAL,DUBLIN FERRYPORT,"N 53°20'48""","W 006°12'01""",53.346667,-6.200278,2020-01-24,2015-06-12,,https://www.icg.ie/our-businesses/container-terminal/dublin-ferryport-terminals/,"Ferryport, Alexandra Road, Dublin 1, Ireland","Berths 50,50A"
IEDUB,,MTL,MARINE TERMINALS LTD,PEEL PORTS GROUP,"N 53°20'36""","W 006°12'38""",53.343333,-6.210556,2020-01-24,2015-06-12,,https://www.peelports.com/ports/dublin,"South Bank Quay Container Terminal, Pigeon House Road, Ringsend, Dublin 4, Ireland","Berths 41,42,43,44,45"
IEDUB,,POEURO,P&O EUROPEAN FERRIES TERMINAL,P&O EUROPEAN FERRIES,"N 53°20'45""","W 006°13'13""",53.345889,-6.220389,2020-02-29,2015-06-12,,,"Terminal 3, North Quay Extension, Dublin 1, Ireland",Berth 21 (RORO terminal)
IEDUB,,PORTRO,PORTROE TERMINAL,DUBLIN PORT,"N 53°20'55""","W 006°12'57""",53.348611,-6.215833,,2015-06-12,,,"Alexandra Quay, Alexandra Road, Dublin 1, Ireland",Berth 30
IEORK,,RDT,RINGASKIDDY DEEPWATER TERMINAL,PORT OF CORK,"N 51°50'02""","W 008°19'43""",51.83375,-8.328611,,2019-07-05,,https://www.portofcork.ie,"Custom House, Custom House Street, Port of Cork Company, Ireland",
IEORK,,TIVO,TIVOLI TERMINAL,PORT OF CORK,"N 51°54'01""","W 008°24'57""",51.900361,-8.415944,,2015-06-12,,https://www.portofcork.ie,"Custom House, Custom House Street, Port of Cork Company, Ireland",
ILASH,,APCL,"ASHDOD PORT CO., LTD.","ASHDOD PORT CO., LTD.","N 31°50'04""","E 034°38'52""",31.834444,34.647778,,2004-05-31,,,,
ILHFA,,HPCL,"HAIFA PORT CO., LTD.","HAIFA PORT CO., LTD.","N 32°49'02""","E 035°00'38""",32.817222,35.010556,,2004-05-31,,,,
INCCU,,CALCUT,KOLKATA DOCK SYSTEM (KDS),KOLKATA PORT TRUST,"N 22°32'24""","E 088°18'01""",22.54,88.300278,,2015-06-12,,http://www.kolkataporttrust.gov.in/,,
INCOK,,ICTT,KOCHI INTERNATIONAL CONTAINER TRANSSHIPMENT TERMINAL (ICTT),INDIA GATEWAY TERMINAL PVT. LTD. / DP WORLD,"N 09°58'41""","E 076°15'08""",9.978056,76.252222,,2020-02-01,,http://igtpl.com/,"ICTT Vallarpadam SEZ, Mulavukadu Village, Kochi, Kerala 682504, India",Locally known as VALLARPADAM TERMINAL
INENR,,AECTPL,ADANI ENNORE CONTAINER TERMINAL,ADANI INTERNATIONAL CONTAINER TERMINAL PVT. LTD.,"N 13°16'19""","E 080°20'16""",13.271944,80.337778,2020-01-03,2019-07-05,,https://www.adaniports.com,,
INIXE,,NMPT,NEW MANGALORE PORT,NEW MANGALORE PORT TRUST,"N 12°56'00""","E 074°49'06""",12.933333,74.818333,2020-01-03,2015-06-24,,http://newmangaloreport.gov.in:8080/#!/,,
INMAA,,CCTL,CHENNAI CONTAINER TERMINAL (CCTL),CHENNAI CONTAINER TERMINAL PVT. LTD. / DP WORLD,"N 13°06'21""","E 080°17'55""",13.105833,80.298611,2020-01-03,2005-09-19,,http://www.dpworldchennai.com/,,
INMAA,,CITPL,CHENNAI INTERNATIONAL CONTAINER TERMINAL (CITPL),CHENNAI INTERNATIONAL TERMINALS PVT LTD / PSA,"N 13°05'38""","E 080°18'06""",13.093889,80.301667,2020-01-03,2015-06-20,,https://www.citpl.co.in/terminal-layout/,,
INMUN,,ACMTPL,ADANI CMA MUNDRA CONTAINER TERMINAL (ACMTPL),ADANI CMA MUNDRA CONTAINER TERMINAL PVT. LTD. (ACMTPL) / CMA-CGM,"N 22°44'20""","E 069°41'09""",22.738889,69.685833,2020-04-01,2020-04-01,,https://www.adaniports.com/,"ACMTPL, Adani Ports & SEZ Ltd. Mundra, Kutch, Gujarat, India. 370421","CT4 (South Basin), berths CB4/CB5"
INMUN,,AICTPL,ADANI INTERNATIONAL CONTAINER TERMINAL (AICTPL),ADANI INTERNATIONAL CONTAINER TERMINAL PVT. LTD. (AICTPL) / MSC,"N 22°44'20""","E 069°41'46""",22.738889,69.696111,2020-04-01,2015-06-12,,https://www.adaniports.com/,"AICTPL, Adani Ports & SEZ Ltd. Mundra, Kutch, Gujarat, India. 370421","CT3 (South Basin), berths CB6/CB7/CB8/CB9"
INMUN,,AMCT,ADANI MUNDRA CONTAINER TERMINAL (AMCT),ADANI MUNDRA CONTAINER TERMINAL PVT. LTD. (AMCT),"N 22°44'46""","E 069°42'29""",22.746111,69.708056,2020-04-01,2020-04-01,,https://www.adaniports.com/,"AMCT, Adani Ports & SEZ Ltd. Mundra, Kutch, Gujarat, India. 370421","CT2, berths CB3/CB4"
INMUN,,MICT,MUNDRA INTERNATIONAL CONTAINER TERMINAL (MICT),MUNDRA INTERNATIONAL CONTAINER TERMINAL PVT. LTD. / DP WORLD,"N 22°44'36""","E 069°42'44""",22.743333,69.712222,2020-04-01,2005-09-19,,http://www.dpworldmundra.com/,,"CT1, berths CB1/CB2"
INNSA,,BMCT,BHARAT MUMBAI CONTAINER TERMINALS,BHARAT MUMBAI CONTAINER TERMINALS PVT. LTD. (PSA),"N 18°56'00""","E 072°56'00""",18.933333,72.933333,,2018-09-17,,,,
INNSA,,GTICI,GATEWAY TERMINALS INDIA (GTI),GATEWAY INDIA TERMINALS PVT. LTD. (APM / CONCOR),"N 18°56'54""","E 072°56'29""",18.948333,72.941389,,2019-04-16,,https://www.apmtmumbai.com,"APM Terminals Mumbai, Gateway Terminals India Pvt. Ltd., GTI House, JNPT, Sheva, Navi Mumbai 400707, India",APM Terminals Mumbai
INNSA,,JNPCT,JAWAHARLAL NEHRU PORT CONTAINER TERMINAL (JNPCT),JAWAHARLAL NEHRU PORT TRUST (JNP),"N 18°56'43""","E 072°56'24""",18.945278,72.94,2015-09-21,2014-10-27,,,,
INNSA,,NSIGT,NHAVA SHEVA (INDIA) GATEWAY TERMINAL (NSIGT),NHAVA SHEVA (INDIA) GATEWAY TERMINAL PVT. LTD. (DP WORLD),"N 18°57'47""","E 072°57'02""",18.963056,72.950556,,2019-04-16,,http://www.dpworldnhavashevaigt.com,"NSIGT, Operation Centre, Near JNPT, Sheva, Navi Mumbai 400707, India",
INNSA,,NSICT,NHAVA SHEVA INTERNATIONAL CONTAINER TERMINAL (NSICT),NHAVA SHEVA INTERNATIONAL CONTAINER TERMINAL PVT. LTD. (DP WORLD),"N 18°57'30""","E 072°56'54""",18.958333,72.948333,,2019-04-16,,http://www.dpworldmumbai.com,"NSICT, Operation Centre, Near JNPT, Sheva, Navi Mumbai 400707, India",
